Paper title,Takeaway from abstract,Source,Year,Citations,Authors,Journal,Influential citations,DOI,DOI URL,Semantic Scholar URL,PDF,Abstract,Takeaway suggests yes/no,Study type
Propensity to trust and the influence of source and medium cues in credibility evaluation,Credibility evaluation is a daily task in the current world of online information that varies in quality.,Search,2012,54,"Teun  Lucassen, Jan Maarten  Schraagen",J. Inf. Sci.,,10.1177/0165551512459921,https://doi.org/10.1177/0165551512459921,https://semanticscholar.org/paper/bd72e9e6d5374fa0790d131ca99bca87e5366302,,"Credibility evaluation has become a daily task in the current world of online information that varies in quality. The way this task is performed has been a topic of research for some time now. In this study, we aim to extend this research by proposing an integrated layer model of trust. According to this model, trust in information is influenced by trust in its source. Moreover, source trust is influenced by trust in the medium, which in turn is influenced by a more general propensity to trust. We provide an initial validation of the proposed model by means of an online quasi-experiment (n = 152) in which participants rated the credibility of Wikipedia articles. Additionally, the results suggest that the participants were more likely to have too little trust in Wikipedia than too much trust.",,
Trustworthy by design,Mobile workers that capture data can have an inaccurate and untrustworthy effect on serious consequences.,Search,2014,11,"Bran  Knowles, Mike  Harding, Lynne  Blair, Nigel  Davies, James  Hannon, Mark  Rouncefield, John  Walden",CSCW,,10.1145/2531602.2531699,https://doi.org/10.1145/2531602.2531699,https://semanticscholar.org/paper/01bf23ba31b8c0d5f03a3e415fe8b4e80db26cc0,,"Driven by changes in working practices and technology trends, organizations are increasingly reliant on mobile workers and the data they capture. However, while significant work has been carried out on increasing the usability of mobile devices and applications, little attention has been paid to the quality of data captured by mobile workers. If this data is inaccurate or untrustworthy, serious consequences can ensue. In this paper we study a system targeted at mobile workers in the highways sector that is deliberately designed to increase the accuracy and trustworthiness of the data collected. The resulting Inspections application has been very positively received by workers and we present lessons that we believe can be applied to other applications of this type.",,
Overview of trustworthiness measurement mechanism and model in TCG,"The basic concepts, main tasks and expected objectives of measurement are summarized and presented.",Search,2013,,Fu  Zhongchuan,,,,,https://semanticscholar.org/paper/5e27a57e48b9bfec6a938cbd7d9483d99f7ba8c4,,"As one of the main bottle necks in Trusted Computing going forward,the technical core of trustworthiness measurement is how to characterize object trustworthiness in accordance with requirement of the trust.This paper states the current state of research and the confronted problems.Firstly,the basic concepts,main tasks and expected objectives of measurement are summarized and presented.Secondly,the framework of measurement,complete measurement process and formal description are described.With considering all factors,in the light of the difference of objects,measurement agents and implementation,some representative model of measurement are discussed.And on that basis,the latest models are classified and summarized respectively,and the directions for continuing research are discussed.",,Review
Trusting the messenger because of the message: feedback dynamics from information quality to source evaluation,Both the competence of a source and its sincerity influence the perceived quality of information.,Search,2014,28,"Fabio  Paglieri, Cristiano  Castelfranchi, Célia da Costa Pereira, Rino  Falcone, Andrea  Tettamanzi, Serena  Villata",Comput. Math. Organ. Theory,,10.1007/s10588-013-9166-x,https://doi.org/10.1007/s10588-013-9166-x,https://semanticscholar.org/paper/fddb49fa9b7c7a1def8142d1f47f7042626ffa8c,https://hal.archives-ouvertes.fr/hal-00906518/file/CMOT2013revised.pdf,"Information provided by a source should be assessed by an intelligent agent on the basis of several criteria: most notably, its content and the trust one has in its source. In turn, the observed quality of information should feed back on the assessment of its source, and such feedback should intelligently distribute among different features of the source—e.g., competence and sincerity. We propose a formal framework in which trust is treated as a multi-dimensional concept relativized to the sincerity of the source and its competence with respect to specific domains: both these aspects influence the assessment of the information, and also determine a feedback on the trustworthiness degree of its source. We provide a framework to describe the combined effects of competence and sincerity on the perceived quality of information. We focus on the feedback dynamics from information quality to source evaluation, highlighting the role that uncertainty reduction and social comparison play in determining the amount and the distribution of feedback.",,
Trustworthiness in Software Environments,"Health monitoring, string kernels, commercial tools, design considerations, and semantic exploitation are various approaches to establishing and monitoring system trustworthiness.",Search,2009,1,"John  Harauz, Jeffrey M. Voas, George F. Hurlburt",IT Professional,,10.1109/MITP.2009.111,https://doi.org/10.1109/MITP.2009.111,https://semanticscholar.org/paper/8c3ef9cbefe096f675c73a505c79f8553fc0269b,,"This article examines several approaches to establishing and monitoring system trustworthiness. In particular, we explore health monitoring, string kernels, available commercial tools, design considerations, and the semantic exploitation of environmental artifacts.",,
Strategies for ensuring trustworthiness in qualitative research projects,Critics are reluctant to accept the trustworthiness of qualitative research.,Search,2004,7509,Andrew K. Shenton,Educ. Inf.,,10.3233/EFI-2004-22201,https://doi.org/10.3233/EFI-2004-22201,https://semanticscholar.org/paper/cbe670d35e449ceed731466c316cd273032b28ca,,"Although many critics are reluctant to accept the trustworthiness of qualitative research, frameworks for ensuring rigour in this form of work have been in existence for many years. Guba’s constructs, in particular, have won considerable favour and form the focus of this paper. Here researchers seek to satisfy four criteria. In addressing credibility, investigators attempt to demonstrate that a true picture of the phenomenon under scrutiny is being presented. To allow transferability, they provide sufficient detail of the context of the fieldwork for a reader to be able to decide whether the prevailing environment is similar to another situation with which he or she is familiar and whether the findings can justifiably be applied to the other setting. The meeting of the dependability criterion is difficult in qualitative work, although researchers should at least strive to enable a future investigator to repeat the study. Finally, to achieve confirmability, researchers must take steps to demonstrate that findings emerge from the data and not their own predispositions. The paper concludes by suggesting that it is the responsibility of research methods teachers to ensure that this or a comparable model for ensuring trustworthiness is followed by students undertaking a qualitative inquiry.",,
Agent-based trust and reputation in the context of inaccurate information sources,Trusters must be able to assess the reliability of resources in order to choose which to rely on.,Search,2006,23,W. T. Luke Teacy,,,,,https://semanticscholar.org/paper/5a9041d42c70c5c087ed16dc9e5f8dbfb85124c1,,"Trust is a prevalent concept in human society that, in essence, concerns our reliance on the actions of other entities within our environment. For example, we may rely on our car starting to get to work on time, and on our fellow drivers, so that we may get there safely. For similar reasons, trust is becoming increasingly important in computing, as systems, such as the Grid, require integration of computing resources, across organisational boundaries. In this context, the reliability of resources in one organisation cannot be assumed from the point of view of another, as certain resources may fail more often than others. For this reason, we argue that software systems must be able to assess the reliability of different resources, so that they may choose which of them to rely on. With this in mind, our goal is to develop mechanisms, or models, to aid decision making by an autonomous agent (the truster), when the consequences of its decisions depend on the actions of other agents (the trustees). To achieve this, we have developed a probabilistic framework for assessing trust based on a trustee's past behaviour, which we have instantiated through the creation of two novel trust models (TRAVOS and TRAVOS-C). These facilitate decision making in two different contexts with regard to trustee behaviour. First, using TRAVOS, a truster can make decisions in contexts where a trustee can only act in one of two ways: either it can cooperate, acting to the truster's advantage; or it can defect, thereby acting against the truster's interests. Second, using TRAVOS-C, a truster can make decisions about trustees that can act in a continuous range of ways, for example, taking into account the delivery time of a service. These models share an ability to account for observations of a trustee's behaviour, made either directly by the truster, or by a third party (reputation source). In the latter case, both models can cope with third party information that is unreliable, either because the sender is lying, or because it has a different world view. In addition, TRAVOS-C can assess a trustee for which there is little or no direct or reported experience, using information about other agents that share characteristics with the trustee. This is achieved using a probabilistic mechanism, which automatically accounts for the amount of correlation observed between agents' behaviour, in a truster's environment.",,