Paper title,Takeaway from abstract,Source,Year,Citations,Authors,Journal,Influential citations,DOI,DOI URL,Semantic Scholar URL,PDF,Abstract,Takeaway suggests yes/no,Study type
Selection of Trusted Factor in Software Trusted Measurement,The trusted factor in software trusted measurement should be extracted through the expert's consideration of software reliability and availability.,Search,2011,,Yi  Tao,,,,,https://semanticscholar.org/paper/3e62af2eb4466db53dc2f78bdb99a5cfe8cee542,,"In trusted computing,the trust measurement of application software is the critical part of the trust chain,due to the fair complexity of modern software scale,the assurance of application software credibility could not rely solely on software data integrity measurement.Therefore,based on software data integrity,the trusted factor should be extracted through comprehensive consideration of software reliability and availability,thus to provide for reliable quantitative basis for the subsequent classification of expert system and to address prediction problems of the unknown software credibility.",,
Incredible: is (almost) all web content trustworthy? analysis of psychological factors related to website credibility evaluation,People characterized by high general trust tend to be more generous in their credibility evaluations.,Search,2014,27,"Maria  Rafalak, Katarzyna  Abramczuk, Adam  Wierzbicki",WWW,,10.1145/2567948.2578997,https://doi.org/10.1145/2567948.2578997,https://semanticscholar.org/paper/af9b45d07e5e9e0378398b80bf2722597d7179c0,,"This paper describes the results of a study conducted in February 2013 on Amazon Mechanical Turk aimed at identifying various determinants of credibility evaluations. 2046 adult participants evaluated credibility of websites with diversified trustworthiness reference index. We concentrated on psychological factors that lead to the characteristic positive bias observed in many working social feedback systems on the Internet. We have used International Personality Item Pool (IPIP) and measured the following traits: trust, conformity, risk taking, need for cognition and intellect. Results suggest that trustworthiness and risk taking are factors clearly differentiating people with respect to tendency to overestimate, underestimate and judge accordingly websites' credibility. Intuitively people characterized by high general trust tend to be more generous in their credibility evaluations. On the other hand, people who are more willing to take risk, tend to be more critical of the Internet content. The latter indicates that high credibility evaluations are being treated as a default option, and lower ratings require special conditions. Other, more detailed psychological patterns related to websites' credibility evaluations are described in full paper.",,
Factors of trust that influence trust worthiness in peer-to-peer (P2P) based e-commerce,Trust can be assigned to a peer in a peer-to-peer system based on various factors.,Search,2004,7,"Farookh Khadeer Hussain, Elizabeth  Chang, Tharam S. Dillon",,,,,https://semanticscholar.org/paper/49f6bd371f7dbd663fa6a5da0c3b4235190cec62,,"Peer-to-Peer Systems are becoming popular. They are widely regarded as the nextgeneration of the Internet. As a result, electronic commerce will be carried out over the peer-to-peer systems in the future rather than in a client-server environment. These Peer-to-Peer (P2P) systems suffer from innumerable problems. Trust between two interacting peers involved in an electronic transaction is one of them. In this paper, we propose the factors that can influence the trustworthiness assigned to the trusted peer. Furthermore we catalogue these factors into three classes and discuss the relationship between these factors.",,
Trustworthiness Attributes and Metrics for Engineering Trusted Internet-Based Software Systems,"Trustworthiness, though, is subject to individual interpretation and preference.",Search,2013,35,"Nazila Gol Mohammadi, Sachar  Paulus, Mohamed  Bishr, Andreas  Metzger, Holger  Könnecke, Sandro  Hartenstein, Thorsten  Weyer, Klaus  Pohl",CLOSER,,10.1007/978-3-319-11561-0_2,https://doi.org/10.1007/978-3-319-11561-0_2,https://semanticscholar.org/paper/8458fc0ecbc37aa30756cbc4c9d4d708475ccf58,,"Trustworthiness of Internet-based software systems, apps, services and platform is a key success factor for their use and acceptance by organizations and end-users. The notion of trustworthiness, though, is subject to individual interpretation and preference, e.g., organizations require confidence about how their business critical data is handled whereas end-users may be more concerned about usability. As one main contribution, we present an extensive list of software quality attributes that contribute to trustworthiness. Those software quality attributes have been identified by a systematic review of the research literature and by analyzing two real-world use cases. As a second contribution, we sketch an approach for systematically deriving metrics to measure the trustworthiness of software system. Our work thereby contributes to better understanding which software quality attributes should be considered and assured when engineering trustworthy Internet-based software systems.",,Systematic Review
What makes websites trustworthy? A two-phase empirical study,Trustworthiness is a key factor in commercial transactions and the same is true for the internet.,Search,2005,19,"Pimmanee  Rattanawicha, Vatcharaporn  Esichaikul",Int. J. Electron. Bus.,,10.1504/IJEB.2005.006906,https://doi.org/10.1504/IJEB.2005.006906,https://semanticscholar.org/paper/692560accf6ed7a953dd9153878a2c97a0a2f866,,"Trustworthiness has been cited as one of the most important factors in the completion of commercial transactions, and this is also true for internet commerce systems. In the internet commerce environment, people do business by interacting with a customer interface which, in this case, is an internet vendor's website. Thus, websites must be designed carefully to induce feelings of trust on the part of the customer, which will influence the decision to buy from a specific vendor. The objective of this research was to identify website design features that have significant effect on customer trust in internet shopping. A two-phase empirical study was conducted. In Phase I, respondents were asked to rate the importance of various website design features in terms of their trust for internet shopping. Forty six features were identified and grouped into nine categories. In Phase II, a different group of respondents were asked to decide whether each of these 46 features and nine categories was a Hygiene factor (i.e., a 'must have' factor, without which a customer would certainly feel distrustful), or a Motivator (i.e., a 'good to have' factor, without which a customer would not feel distrustful, but which, if present, could increase the customer's perception of trustworthiness).",,
Trustworthiness criteria for supporting users to assess the credibility of web information,"The normative trustworthiness criteria, authority, currency, accuracy, and relevance can be used to support users' assessments of the trustworthiness of Web information.",Search,2013,21,"Jarutas  Pattanaphanchai, Kieron  O'Hara, Wendy  Hall",WWW '13 Companion,,10.1145/2487788.2488132,https://doi.org/10.1145/2487788.2488132,https://semanticscholar.org/paper/9adf6b120bcb40e317160baed50cbbdb791931af,,"Assessing the quality of information on the Web is a challenging issue for at least two reasons. First, as a decentralized data publishing platform in which anyone can share nearly anything, the Web has no inherent quality control mechanisms to ensure that content published is valid, legitimate, or even just interesting. Second, when assessing the trustworthiness of web pages, users tend to base their judgments upon descriptive criteria such as the visual presentation of the website rather than more robust normative criteria such as the author's reputation and the source's review process. As a result, Web users are liable to make incorrect assessments, particularly when making quick judgments on a large scale. Therefore, Web users need credibility criteria and tools to help them assess the trustworthiness of Web information in order to place trust in it. In this paper, we investigate the criteria that can be used to collect supportive data about a piece of information in order to improve a person's ability to quickly judge the trustworthiness of the information. We propose the normative trustworthiness criteria namely, authority, currency, accuracy and relevance which can be used to support users' assessments of the trustworthiness of Web information. In addition, we validate these criteria using an expert panel. The results show that the proposed criteria are helpful. Moreover, we obtain weighting scores for criteria which can be used to calculate the trustworthiness of information and suggest a piece of information that is more likely to be trustworthy to Web users.",,Review
Improving trust using online credibility sources and social network quality in P2P marketplaces,"A trust model improves trust between users, normally in the context of p2p transactions, based on online credibility sources and social network quality metrics.",Search,2013,11,"Mauro  Nunes, Joao  Correia",2013 8th Iberian Conference on Information Systems and Technologies (CISTI),,,,https://semanticscholar.org/paper/4b1f97ff9685e7d759a9c139f859d152171ab84d,,"In p2p marketplaces, users often have to decide if someone is trustworthy or not. Sometimes, this decision is based purely on faith, which is something not everyone is willing to do. For this reason, trust has been identified as one of the key factors for the success of the sharing economy. Over the years trust mechanisms have been developed on a per site basis (i.e. feedback, voting or reputation systems) and users have been slowly building trust in these sites and leaving a reputation trail as they move from site to site. This process should be more efficient and users must be able to use the hard earned reputation to show they are trustworthy. To this end, we present a trust model for improving trust between users, normally in the context of p2p transactions, based on online credibility sources and social network quality metrics. In this paper we formally define a multi-dimensional trust model adapted to p2p marketplaces, introduce WhyTrusted.com prototype as a proof-of-concept that is able to capture, process, and translate data into relevant dimensions of the trust model to measure a person's perceived trustworthiness with a portable, cross-platform trust score, and use an empirical analysis to confirm that the WhyTrusted trust score and source ratings improve a user's propensity to trust.",,
Trustworthy groups and organisations,The preference for trustworthy individuals over untrustworthy ones is not limited to individual interactions.,Search,2017,23,Katherine  Hawley,,,10.1093/ACPROF:OSO/9780198732549.003.0014,https://doi.org/10.1093/ACPROF:OSO/9780198732549.003.0014,https://semanticscholar.org/paper/d49cb83d734d14ce1bcee687425aae362058e9b5,https://research-repository.st-andrews.ac.uk/bitstream/10023/17203/1/Hawley_Trustworthy_Chapter_AAM.pdf,"1. The Significance of Group Trustworthiness We value trustworthiness where we find it, in friends, colleagues, and strangers. This is because it is easier to cooperate with trustworthy individuals than with untrustworthy ones, but also because trustworthiness is appreciated for its own sake. Conversely, we resent untrustworthiness when we encounter it, and try to minimise interaction with untrustworthy individuals. This preference for trustworthiness over untrustworthiness is not limited to our interactions with individuals. Who wouldn’t prefer to work for a trustworthy company, to be treated at a trustworthy hospital, and to vote for a trustworthy political party?",,
Factors of Trusting in International Business,"Trusting as action signals the possibility of individual choices, new decisions and the potential for building more meaningful relationships.",Search,2007,1,"K.  Illes, R.  Krishna",,,,,https://semanticscholar.org/paper/43c4993aa2639b4c86ff4754c0463cb79e45a9b3,,"The paper reports on an online survey that set out to identify some of the factors of trusting. The survey was open to all nationalities and asked a broad variety of questions regarding individual choices of trusting.

The authors give a brief overview of trust in different disciplines and argue that defining trust as an action provides a new platform for examining our relationships inside and outside organisations. Trusting as action signals the possibility of individual choices, new decisions and the potential for building more meaningful relationships.

This paper identifies a set of factors that can form a basis for personal reflection and also provide a starting point for an organisational review of relationships in the workplace. Such a review is particularly valuable when members of the organisation come from different cultural background. Understanding our factors of trusting is the first step towards appreciating the needs of others in long term relationship building.

The authors suggest that a more in depth survey could ascertain the validity of this pilot study. Understanding our own factors of trusting will enable us to recognise and accommodate the needs of others and build trusting relationships both in national and in international business.",,Review
Trustworthiness,"Leaders who can admit mistakes, acknowledge weakness, applaud strength, and help each other will be capable of building trust.",Search,2002,,Karl  Rihaczek,Datenschutz und Datensicherheit,,10.4018/978-1-7998-8950-2.ch004,https://doi.org/10.4018/978-1-7998-8950-2.ch004,https://semanticscholar.org/paper/ce12be690c737e7aa12884deadba60f6b613f535,,"We can use trustworthiness and trust interchangeably because they both relate to the importance of LMX. Trustworthiness, then, is the quality of a person, or a thing, that inspires reliability. The existence of trustworthiness is shown through qualities like being respectful, honest, consistent, positive, and selfless. Leaders who can admit mistakes, acknowledge weakness, applaud strength, and help each other, and who can promote those qualities in the workforce, will be capable of building trust. Mutual trust is important, and everyone has a lot at stake with trust issues because of the inherent risks. Those risks are about putting one's faith or a pending decision in the hands of someone in whom you have not yet developed confidence in, or in whom there are limits to that confidence. Leaders who follow telework policies developed in response to COVID-19 must build trust with subordinates and superiors alike. Trust can then grow as emotions are shared, real understanding developed, and core issues are addressed professionally.",,
Metrics and measurement of trustworthy systems,Security and dependability metrics are not sufficient for measuring the quality of systems that are placed in a multi-domain environment.,Search,2016,16,"Jin-Hee  Cho, Patrick M. Hurley, Shouhuai  Xu",MILCOM 2016 - 2016 IEEE Military Communications Conference,,10.1109/MILCOM.2016.7795500,https://doi.org/10.1109/MILCOM.2016.7795500,https://semanticscholar.org/paper/3d1bc552e6b7010228bf360d5b339d8e43266b73,,"Accurate measurement of the quality of systems is crucial to building trustworthy systems. Such a measurement indicates whether a system is working properly and meeting its requirements. Although security and dependability metrics are regarded as key metrics for measuring the quality of systems, they are not sufficient for measuring the quality of systems that are placed in a multi-domain environment including hardware, software, network, human factors, and physical environments. In order to embrace multidimensional aspects of the quality of a system, we introduce a trustworthiness metric framework that supports three key submetrics of trust, resilience, and agility, and propose an ontology-based framework with three corresponding sub-ontologies. We also discuss how the key metrics are related to the severity of threats and the quality of assessment tools. This work is part of the cyber defense effort conducted by the Trustworthy Systems Working Group (TSWG) under the Cyber Strategic Challenge Group (CSCG) of The Technical Cooperation Program (TTCP), which is an international cooperation organization for enhancing defense science and technology.",,
Trustworthiness evaluation system in E-Commerce context,"Trustworthiness is a measure of any system that provides users, service providers, and communities an assurance and advice to select a particular e-commerce platform.",Search,2016,,"Harshal D. Dalvi, Abhijit  Joshi, Narendra  Shekokar",2016 International Conference on Computing Communication Control and automation (ICCUBEA),,10.1109/ICCUBEA.2016.7860036,https://doi.org/10.1109/ICCUBEA.2016.7860036,https://semanticscholar.org/paper/7743ffdb4c5a3df634c94e04fb361255fd921db0,,"Today, E-Commerce has become the largest revenue generation industry, letting seller sell everything from a pen to plane to the customers across the globe. Over an E-commerce platform where user and vendor merely interact with each other, the trust is undeniably the most important factor for users to perform transactions online. But at the same time it can't be assessed directly using some pre-defined metrics. It has to be perceived from various indicators. Trustworthiness is a measure of any system as a whole provides users, service providers and communities, an assurance and advice to select a particular ecommerce platform that helps in minimizing a risk of fraud. In this paper, we are soliciting a feedback evaluation system that will act as a decision support system, which can assist users to measure the trustworthiness and usefulness of the user opinion about a product or a service by evaluating the trust degree.",,
Formative variables of trustworthiness on Instagram online sellers,Four indicators from 12 that represent trustworthiness in Instagram online sellers can classify into four variables.,Search,2018,2,"Ascaryan  Rafinda, Agus  Suroso, Ascariena  Rafinda, Putri  Purwaningtyas",,,,,https://semanticscholar.org/paper/bdaf8590ce2addb228f01b37c3cfb9ba4f5fc270,,"This research aims to develop an indicator of trust in Online Seller Application Instagram. Instagram is a sharing picture application that used uniquely by Indonesian as a medium for a seller and buyer to meet. Deception was the biggest risk when people used online shopping. This study identifies an indicator of trustworthiness in Instagram Online seller application. Four indicators were proposed and proven could measure trust in online sellers. There are some followers, price rationality, image quality and seller response. Samples from this study were users of Instagram Online users. Total 20 informants for qualitative study and 488 respondents for the quantitative study participated in this research. This research used the mixed method. A qualitative method to identify and classify potential indicator for trustworthiness on Instagram seller, while quantitative method was used to measure the construct validity and reliability of trustworthiness on instagram online seller. The result show that from 12 indicators that represent trustworthiness in instagram online seller, it could classify into four variables by using Exploratory Factors Analysis (EFA). This research imply for Instagram seller, they should pay attention to factors that found by this research to gain trust from the customers.",,
Trustworthiness,Trustworthiness is a matter of avoiding unfulfilled commitments.,Search,2019,1,Katherine  Hawley,How To Be Trustworthy,,10.1093/oso/9780198843900.003.0004,https://doi.org/10.1093/oso/9780198843900.003.0004,https://semanticscholar.org/paper/6083a97b5fc6e72b366fb1c2dd0e8349cd301045,,"This chapter explains the account of trustworthiness and untrustworthiness which fits the commitment account of trust and distrust. Trustworthiness is a matter of avoiding unfulfilled commitments, which requires both caution in incurring new commitments and diligence in fulfilling existing commitments. On this view, one can be trustworthy regardless of one’s motives for fulfilling one’s commitments. This is a negative account of trustworthiness, which means that one can be trustworthy whilst avoiding commitments as far as possible. In practice, through friendship, work and other social engagements we take on meta-commitments—commitments to incur future commitments. These can make it a matter of trustworthiness to take on certain new commitments. Untrustworthiness can arise from insincerity or bad intentions, but it can also arise from enthusiasm and becoming over-committed. A trustworthy person must not allow her commitments to outstrip her competence.",,
Trust in wikipedia: how users trust information from an unknown source,"The three most important features that Wikipedia readers use to assess the trustworthiness of articles are textual features, references, and images.",Search,2010,74,"Teun  Lucassen, Jan Maarten Schraagen",WICOW '10,,10.1145/1772938.1772944,https://doi.org/10.1145/1772938.1772944,https://semanticscholar.org/paper/b5425203f36f7a6d86ef366a0a51588029384d80,,"The use of Wikipedia as an information source is becoming increasingly popular. Several studies have shown that its information quality is high. Normally, when considering information trust, the source of information is an important factor. However, because of the open-source nature of Wikipedia articles, their sources remain mostly unknown. This means that other features need to be used to assess the trustworthiness of the articles. We describe article features - such as images and references - which lay Wikipedia readers use to estimate trustworthiness. The quality and the topics of the articles are manipulated in an experiment to reproduce the varying quality on Wikipedia and the familiarity of the readers with the topics. We show that the three most important features are textual features, references and images.",,
Trustworthiness,Trustworthiness is an epistemic desideratum.,Search,2008,130,Catherine Z. Elgin,,,10.1080/05568640809485227,https://doi.org/10.1080/05568640809485227,https://semanticscholar.org/paper/a777c01c67d56793abe6406549dbf3f4ac2003c1,,"Abstract I argue that trustworthiness is an epistemic desideratum. It does not reduce to justified or reliable true belief, but figures in the reason why justified or reliable true beliefs are often valuable. Such beliefs can be precarious. If a belief's being justified requires that the evidence be just as we take it to be, then if we are off even by a little, the belief is unwarranted. Similarly for reliability. Although it satisfies the definition of knowledge, such a belief is not trustworthy. We ought not use it as a basis for inference or action and ought not give others to believe it. The trustworthiness of a belief, I urge, depends on its being backed by reasons—considerations that other members of the appropriate epistemic community cannot reasonably reject. Trustworthiness is intersubjective. It both depends on and contributes to the evolving cognitive values of an epistemic community.",,
Assessing Trustworthiness in Online Goods and Services,The factors of competence and motivation are key bases of individuals’ inferences about trustworthiness.,Search,2009,4,"Karen S. Cook, Coye  Cheshire, Am  Gerbasi, B  Aven",,,,,https://semanticscholar.org/paper/34a9c6377d6d7df1a7141d8bdf3f48e05dfac6c1,,"Assessing the trustworthiness of others is an essential part of the daily interactions that take place between individuals in various social settings. The level of uncertainty and the nature of what is at stake affect the risks involved in a given interaction situation. Furthermore, the mechanisms that are put in place to help individuals assess the trustworthiness of others typically vary according to the levels of uncertainty and risk in the setting. As it becomes progressively more common to interact and engage in exchanges using computer-mediated communication systems such as the Internet, the anonymity of individuals and the reduction in available social cues increase the risks as well as the possibilities for misjudging trustworthiness and thus increase the possibilities for significant loss or even harm. In this chapter we examine the factors that individuals use when determining the trustworthiness of exchange partners who provide either goods or services in online environments. Following current theory and research, we argue that the competence and motivations of the exchange partner are two key bases of individuals’ inferences about trustworthiness, particularly when there are no third-party or credible institutional devices in place to reduce uncertainty and manage risk. However, we demonstrate that the effects of competence and motivation have different relative degrees of importance in online goods markets compared to online service markets. We present the results of an exploratory study designed to examine how individuals assess the trustworthiness of others in online markets for goods and services.",,
