Paper title,Takeaway from abstract,Source,Year,Citations,Authors,Journal,Influential citations,DOI,DOI URL,Semantic Scholar URL,PDF,Abstract,Takeaway suggests yes/no,Study type
Trustworthy artificial intelligence,"Trustworthy AI bases on the idea that trust builds the foundation of societies, economies, and sustainable development.",Search,2021,21,"Scott  Thiebes, Sebastian  Lins, Ali  Sunyaev",Electron. Mark.,,10.1007/S12525-020-00441-4,https://doi.org/10.1007/S12525-020-00441-4,https://semanticscholar.org/paper/9da092d7c7674e96830f8d6713a9a4f8101f984c,https://link.springer.com/content/pdf/10.1007/s12525-020-00441-4.pdf,"Artificial intelligence (AI) brings forth many opportunities to contribute to the wellbeing of individuals and the advancement of economies and societies, but also a variety of novel ethical, legal, social, and technological challenges. Trustworthy AI (TAI) bases on the idea that trust builds the foundation of societies, economies, and sustainable development, and that individuals, organizations, and societies will therefore only ever be able to realize the full potential of AI, if trust can be established in its development, deployment, and use. With this article we aim to introduce the concept of TAI and its five foundational principles (1) beneficence, (2) non-maleficence, (3) autonomy, (4) justice, and (5) explicability. We further draw on these five principles to develop a data-driven research framework for TAI and demonstrate its utility by delineating fruitful avenues for future research, particularly with regard to the distributed ledger technology-based realization of TAI.",,
Trust in Artificial Intelligence: Australian Insights,Australians have low trust in AI but generally accept or tolerate AI.,Search,2020,5,"Steve  Lockey, Nicole  Gillespie, Caitlin  Curtis",,,10.14264/b32f129,https://doi.org/10.14264/b32f129,https://semanticscholar.org/paper/6c2714f81bc323851052920d240bc21b98e2a9f8,https://espace.library.uq.edu.au/view/UQ:b32f129/LockeyGillespieCurtis_Trust_In_AI.pdf,"Artificial Intelligence (AI) is the cornerstone technology of the Fourth Industrial Revolution and is enabling rapid innovation with many potential benefits for Australian society (e.g. enhanced healthcare diagnostics, transportation optimisation) and business (e.g. enhanced efficiency and competitiveness). The COVID-19 pandemic has accelerated the uptake of advanced technology, and investment in AI continues to grow exponentially.AI also poses considerable risks and challenges to society which raises concerns about whether AI systems are worthy of trust. These concerns have been fuelled by high profile cases of AI use that were biased, discriminatory, manipulative, unlawful, or violated privacy or other human rights. Without public confidence that AI is being developed and used in an ethical and trustworthy manner, it will not be trusted and its full potential will not be realised. To echo the sentiment of Dr Alan Finkel AO, Australia’s Chief Scientist, acceptance of AI rests on “the essential foundation of trust”. Are we capable of extending our trust to AI? This national survey is the first to take a deep dive into answering this question and understanding community trust and expectations in relation to AI. To do this, we surveyed a nationally representative sample of over 2,500 Australian citizens in June to July 2020. Our findings provide important and timely research insights into the public’s trust and attitudes towards AI and lay out a pathway for strengthening trust and acceptance of AI systems.Key findings include:              - Trust is central to the acceptance of AI, and is influenced by four key drivers;              - Australians have low trust in AI systems but generally ‘accept’ or ‘tolerate’ AI;              - Australians expect AI to be regulated and carefully managed;              - Australians expect organisations to uphold the principles of trustworthy AI;              - Australians feel comfortable with some but not all uses of AI at work;              - Australians want to know more about AI but currently have low awareness and understanding of AI and its uses.We draw out the implications of the findings for government, business and NGOs and provide a roadmap to enhancing public trust in AI highlighting three key actions:              - Live up to Australian’s expectations of trustworthy AI              - Strengthen the regulatory framework for governing AI              - Strengthen Australia’s AI literacy",,
Attachment and trust in artificial intelligence,People with a secure attachment style have a greater trust in artificial intelligence.,Search,2021,21,"Omri  Gillath, Ting  Ai, Michael  Branicky, Shawn  Keshmiri, Rob  Davison, Ryan  Spaulding",Comput. Hum. Behav.,,10.1016/j.chb.2020.106607,https://doi.org/10.1016/j.chb.2020.106607,https://semanticscholar.org/paper/d7e73699049a73cf90c82a7b5aef589d84dbe794,,"Abstract Lack of trust is one of the main obstacles standing in the way of taking full advantage of the benefits artificial intelligence (AI) has to offer. Most research on trust in AI focuses on cognitive ways to boost trust. Here, instead, we focus on boosting trust in AI via affective means. Specifically, we tested and found associations between one's attachment style—an individual difference representing the way people feel, think, and behave in relationships—and trust in AI. In Study 1 we found that attachment anxiety predicted less trust. In Study 2, we found that enhancing attachment anxiety reduced trust, whereas enhancing attachment security increased trust in AI. In Study 3, we found that exposure to attachment security cues (but not positive affect cues) resulted in increased trust as compared with exposure to neutral cues. Overall, our findings demonstrate an association between attachment security and trust in AI, and support the ability to increase trust in AI via attachment security priming.",,
"A Review of Trust in Artificial Intelligence: Challenges, Vulnerabilities and Future Directions","Artificial Intelligence (AI) can benefit society, but it is also fraught with risks.",Search,2021,4,"Steven  Lockey, Nicole M. Gillespie, Daniel  Holm, Ida Asadi Someh",HICSS,,10.24251/HICSS.2021.664,https://doi.org/10.24251/HICSS.2021.664,https://semanticscholar.org/paper/1f11e05c5484ff5a066eab37c6268ad7aceaac8d,http://scholarspace.manoa.hawaii.edu/bitstream/10125/71284/1/0534.pdf,"Artificial Intelligence (AI) can benefit society, but it is also fraught with risks. Societal adoption of AI is recognized to depend on stakeholder trust in AI, yet the literature on trust in AI is fragmented, and little is known about the vulnerabilities faced by different stakeholders, making it is difficult to draw on this evidence-base to inform practice and policy. We undertake a literature review to take stock of what is known about the antecedents of trust in AI, and organize our findings around five trust challenges unique to or exacerbated by AI. Further, we develop a concept matrix identifying the key vulnerabilities to stakeholders raised by each of the challenges, and propose a multi-stakeholder approach to future research.",,Review
Trust in Artificial Intelligence,"Artificial intelligence is being used for scheduling appointments, powering smart homes, recognizing people’s faces in photos, making health diagnoses, and several other things.",Search,2018,14,Arathi  Sethumadhavan,Ergonomics in Design: The Quarterly of Human Factors Applications,,10.1177/1064804618818592,https://doi.org/10.1177/1064804618818592,https://semanticscholar.org/paper/94a43052c729c8e7e3f28c50c76e46d09ec95f62,https://journals.sagepub.com/doi/pdf/10.1177/1064804618818592,"Trust is fundamental to creating a lasting relationship with another human being. In our daily lives, we encounter several situations where we place trust on other humans such as bus drivers, colleagues, and even strangers. Trust in human-human teams is initially founded on the predictability of the trustee, and as the relationship between the trustor and the trustee progresses, dependability or integrity replaces predictability as the basis of trust (Hoff & Bashir, 2015). As artificial intelligence (AI) gets smarter and smarter, it is becoming an integral part of human lives. For example, AI is being used for scheduling appointments, powering smart homes, recognizing people’s faces in photos, making health diagnoses, providing investment advice, and several other things. As with a humanhuman team, trust is a necessary ingredient for human-AI partnerships. However, trust in human-human teams progresses in the reverse order from human-human teams (e.g., Hoff & Bashir, 2015). This is because humans initially assume that AI is near perfect. Therefore, in the initial stages, faith forms the essential constituent of trust, and as the number of exchanges between the human and the AI increases, faith is replaced by dependability and predictability. Trust in AI is considered a twodimensional construct comprising trust and distrust, where trust is associated with feelings of calmness and security and distrust involves fear and worry (Lyons, Stokes, Eschleman, Alarcon, & Barelka, 2011). Unarguably, trust is a complex social process with a variety of factors determining the extent to which humans trust AI agents (Hoff & Bashir, 2015; Lee & See, 2004). Specifically, in order to calibrate the right level of trust in AI, consider dispositional (i.e., user characteristics such as age, culture, gender, and personality), internal (e.g., user characteristics such as workload, mood, self-confidence, and working memory capacity), environmental (e.g., task difficulty, perceived risks and benefits, organizational setting), and learned factors (e.g., reputation of the AI, reliability, consistency, type and timing of errors made by the AI, and users’ experience with similar agents). Design factors (e.g., appearance, ease of use, communication style, and transparency of the AI) also affect perceptions of trust. For example, anthrophomorphizing is an effective way of establishing a long-term social bond between humans and AI agents, which is driven by the neurotransmitter and hormone, oxytocin (e.g., de Visser et al., 2017). Further, anthropomorphic agents also resist breakdown in trust compared to their counterpart non-anthropomorphic agents, presumably because anthropomorphic agents remind users of humans who are forgiven more easily for being imperfect in comparison to machine-like agents. Interestingly, there is also evidence that humans tend to disclose more information to AI therapists than human therapists. Transparency of the AI also helps to calibrate the right level of trust by enabling users to develop accurate mental models of the AI underpinnings (e.g., Balfe, Sharples, & Wilson, 2018). 818592 ERGXXX10.1177/1064804618818592ergonomics in designergonomics in design research-article2018",,
Trust in Artificial Intelligence: What do we know and why is it important?,"There is a fragmented, disjointed, and siloed literature on the relationship between trust and AI.",Search,2020,,Steve  Lockey,,,10.37421/JTSM.2020.9.207,https://doi.org/10.37421/JTSM.2020.9.207,https://semanticscholar.org/paper/1a2bf8b563290014a4375cee463f4bd4f34bfa45,,"The rise of Artificial Intelligence (AI) in our society is becoming ubiquitous and undoubtedly holds much promise. However, AI has also been implicated in high profile breaches of trust or ethical standards, and concerns have been raised over the use of AI in initiatives and technologies that could be inimical to society. Public trust and perceptions of AI trustworthiness underpin AI systems’ social licence to operate, and a myriad of company, industry, governmental and intergovernmental reports have set out principles for ethical and trustworthy AI. To guide the responsible stewardship of AI into our society, a firm foundation of research on trust in AI to enable evidence-based policy and practice is required. However, in order to inform and guide future research, it is imperative to first take stock and understand what is already know about human trust in AI. As such, we undertake a review of 100 papers examining the relationship between trust and AI. We found a fragmented, disjointed and siloed literature with an empirical emphasis on experimentation and surveys relating to specific AI technologies. While findings suggest some convergence on the importance of explainability as a determinant of trust in AI technologies, there are still gaps between conceptual arguments and what has been examined empirically. We urge future research to take a more holistic approach and investigate how trust in different referents impacts on attitudinal and behavioural intentions. Doing so will facilitate a more nuanced understanding of what it means to develop trustworthy AI.",,Review
Trust in Distributed Artificial Intelligence,Trust allows interactions between agents where there may have been no effective interaction possible before trust.,Search,1992,90,Stephen  Marsh,MAAMAW,,10.1007/3-540-58266-5_6,https://doi.org/10.1007/3-540-58266-5_6,https://semanticscholar.org/paper/6d296cd0ddaccb6d01aa197c9ba5a04afee2d399,,"A discussion of trust is presented which focuses on multiagent systems, from the point of view of one agent in a system. The roles trust plays in various forms of interaction are considered, with the view that trust allows interactions between agents where there may have been no effective interaction possible before trust. Trust allows parties to acknowledge that, whilst there is a risk in relationships with potentially malevolent agents, some form of interaction may produce benefits, where no interaction at all may not. In addition, accepting the risk allows the trusting agent to prepare itself for possibly irresponsible or untrustworthy behaviour, thus minimizing the potential damage caused. A formalism is introduced to clarify these notions, and to permit computer simulations. An important contribution of this work is that the formalism is not allen-compassing: there are some notions of trust that are excluded. What it describes is a specific view of trust.",,
Transparency and trust in artificial intelligence systems,Transparency can have a negative impact on trust in artificial intelligence systems.,Search,2020,20,"Philipp  Schmidt, Felix  Bießmann, Timm  Teubner",J. Decis. Syst.,,10.1080/12460125.2020.1819094,https://doi.org/10.1080/12460125.2020.1819094,https://semanticscholar.org/paper/7a19f30e02c34c4eb7b197d3bcd4fbcb8a4e1602,,"ABSTRACT Assistive technology featuring artificial intelligence (AI) to support human decision-making has become ubiquitous. Assistive AI achieves accuracy comparable to or even surpassing that of human experts. However, often the adoption of assistive AI systems is limited by a lack of trust of humans into an AI’s prediction. This is why the AI research community has been focusing on rendering AI decisions more transparent by providing explanations of an AIs decision. To what extent these explanations really help to foster trust into an AI system remains an open question. In this paper, we report the results of a behavioural experiment in which subjects were able to draw on the support of an ML-based decision support tool for text classification. We experimentally varied the information subjects received and show that transparency can actually have a negative impact on trust. We discuss implications for decision makers employing assistive AI technology.",,
Trust in Artificial Intelligence: Meta-Analytic Findings.,Factors such as AI reliability and anthropomorphism are significant predictors of trust in AI.,Search,2021,1,"Alexandra D Kaplan, Theresa T Kessler, J Christopher Brill, P A Hancock",Human factors,,10.1177/00187208211013988,https://doi.org/10.1177/00187208211013988,https://semanticscholar.org/paper/4ad12e5c49202187f2a85351d417f81dc86b8524,,"OBJECTIVE

The present meta-analysis sought to determine significant factors that predict trust in artificial intelligence (AI). Such factors were divided into those relating to (a) the human trustor, (b) the AI trustee, and (c) the shared context of their interaction.

BACKGROUND

There are many factors influencing trust in robots, automation, and technology in general, and there have been several meta-analytic attempts to understand the antecedents of trust in these areas. However, no targeted meta-analysis has been performed examining the antecedents of trust in AI.

METHOD

Data from 65 articles examined the three predicted categories, as well as the subcategories of human characteristics and abilities, AI performance and attributes, and contextual tasking. Lastly, four common uses for AI (i.e., chatbots, robots, automated vehicles, and nonembodied, plain algorithms) were examined as further potential moderating factors.

RESULTS

Results showed that all of the examined categories were significant predictors of trust in AI as well as many individual antecedents such as AI reliability and anthropomorphism, among many others.

CONCLUSION

Overall, the results of this meta-analysis determined several factors that influence trust, including some that have no bearing on AI performance. Additionally, we highlight the areas where there is currently no empirical research.

APPLICATION

Findings from this analysis will allow designers to build systems that elicit higher or lower levels of trust, as they require.",,Meta-Analysis
How to Trust the Middle Artificial Intelligence: Uncertainty Oriented Evaluation,There is considerable interest in the human-level machine intelligence.,Search,2019,,"Marwa  Brichni, Said El Gattoufi",ISDA,,10.1007/978-3-030-49342-4_42,https://doi.org/10.1007/978-3-030-49342-4_42,https://semanticscholar.org/paper/6fe718161f1d31b1f533015b3f7360e849742da8,,"These last years have seen a renewed importance in measuring machine intelligence and considerable interest in the human-level machine intelligence. Despite this interest, few to the best of our knowledge who proposed a classification for these evaluations.",,
Trusting Artificial Intelligence in Healthcare,People show much less trust in machines offering mortgage advice compared to mortgage brokers.,Search,2018,2,"Weiyu  Wang, Keng  Siau",AMCIS,,,,https://semanticscholar.org/paper/39872923340739926acb85bd580a49a4c2b32891,,"Artificial Intelligence (AI) is able to perform at humans and even surpass human’s performances in some tasks. Recent cases about self-driving cars, cashier-free supermarket Amazon Go, and virtual assistants such as Apple’s Siri and Google Assistant have illustrated the current and future potential of AI. AI and its applications have infiltrated human’s work and daily life. It is inevitable that humans need to build a working relationship with AI and its applications. On one hand, humans can benefit from this new technology, for instance, a home robot can release housewife from mundane and monotonous tasks (Siau 2017, Siau 2018). On the other hand, the potential threats pose by AI and the possible social upheavals should not be overlooked. The fatal crash of self-driving cars, the data breach of famous websites, and the potential unemployment of cab and truck drivers are hindering human’s trust and acceptance of this new technology. A study conducted by HSBC shows that only 8% of the participants would trust a machine offering mortgage advice compared to 41% trusting a mortgage broker.",,
Trusting artificial intelligence in cybersecurity is a double-edged sword,Trust in AI for cybersecurity is unwarranted and some form of control to ensure the deployment of ‘reliable AI’ for cybersecurity is necessary.,Search,2019,28,"Mariarosaria  Taddeo, Tom  McCutcheon, Luciano  Floridi",Nat. Mach. Intell.,,10.1038/s42256-019-0109-1,https://doi.org/10.1038/s42256-019-0109-1,https://semanticscholar.org/paper/a485c4c937a4b229455d611129ff4cd6a628f259,https://ora.ox.ac.uk/objects/uuid:8188813d-138e-409d-8686-d2d7d5fa0879/download_file?safe_filename=Trusting%2BAI%2Bin%2BCybersecurity.pdf&file_format=application%2Fpdf&type_of_work=Journal+article,"Applications of artificial intelligence (AI) for cybersecurity tasks are attracting greater attention from the private and the public sectors. Estimates indicate that the market for AI in cybersecurity will grow from US$1 billion in 2016 to a US$34.8 billion net worth by 2025. The latest national cybersecurity and defence strategies of several governments explicitly mention AI capabilities. At the same time, initiatives to define new standards and certification procedures to elicit users’ trust in AI are emerging on a global scale. However, trust in AI (both machine learning and neural networks) to deliver cybersecurity tasks is a double-edged sword: it can improve substantially cybersecurity practices, but can also facilitate new forms of attacks to the AI applications themselves, which may pose severe security threats. We argue that trust in AI for cybersecurity is unwarranted and that, to reduce security risks, some form of control to ensure the deployment of ‘reliable AI’ for cybersecurity is necessary. To this end, we offer three recommendations focusing on the design, development and deployment of AI for cybersecurity.Current national cybersecurity and defence strategies of several governments mention explicitly the use of AI. However, it will be important to develop standards and certification procedures, which involves continuous monitoring and assessment of threats. The focus should be on the reliability of AI-based systems, rather than on eliciting users’ trust in AI.",,
Human Trust in Artificial Intelligence: Review of Empirical Research,The success of integrating AI into various industries depends on the level of human trust in the technology.,Search,2020,107,"Ella  Glikson, Anita Williams Woolley",,,10.5465/annals.2018.0057,https://doi.org/10.5465/annals.2018.0057,https://semanticscholar.org/paper/ef0c62ff070a476f216fe478cc190c773f12a1f6,,Artificial intelligence (AI) characterizes a new generation of technologies capable of interacting with the environment and aiming to simulate human intelligence. The success of integrating AI into...,,Review
Requirements for Trustworthy Artificial Intelligence - A Review,"The field of algorithmic decision-making, particularly Artificial Intelligence (AI), has been drastically changing.",Search,2020,8,"Davinder  Kaur, Suleyman  Uslu, Arjan  Durresi",NBiS,,10.1007/978-3-030-57811-4_11,https://doi.org/10.1007/978-3-030-57811-4_11,https://semanticscholar.org/paper/ab7f6628cbbafae1ce994929af2482efbd092d61,https://scholarworks.iupui.edu/bitstream/1805/28055/1/Kaur2020Requirements-AAM.pdf,"The field of algorithmic decision-making, particularly Artificial Intelligence (AI), has been drastically changing. With the availability of a massive amount of data and an increase in the processing power, AI systems have been used in a vast number of high-stake applications. So, it becomes vital to make these systems reliable and trustworthy. Different approaches have been proposed to make theses systems trustworthy. In this paper, we have reviewed these approaches and summarized them based on the principles proposed by the European Union for trustworthy AI. This review provides an overview of different principles that are important to make AI trustworthy.",,Review
Trust in artificial intelligence for medical diagnoses.,People have comparable standards of performance for AI and human doctors and that trust in AI does not increase when people are told the AI outperforms the human doctor.,Search,2020,5,"Georgiana  Juravle, Andriana  Boudouraki, Miglena  Terziyska, Constantin  Rezlescu",Progress in brain research,,10.1016/bs.pbr.2020.06.006,https://doi.org/10.1016/bs.pbr.2020.06.006,https://semanticscholar.org/paper/06f0bb0b40507020a9866dc8f35f5a26700b33af,,"We present two online experiments investigating trust in artificial intelligence (AI) as a primary and secondary medical diagnosis tool and one experiment testing two methods to increase trust in AI. Participants in Experiment 1 read hypothetical scenarios of low and high-risk diseases, followed by two sequential diagnoses, and estimated their trust in the medical findings. In three between-participants groups, the first and second diagnoses were given by: human and AI, AI and human, and human and human doctors, respectively. In Experiment 2 we examined if people expected higher standards of performance from AI than human doctors, in order to trust AI treatment recommendations. In Experiment 3 we investigated the possibility to increase trust in AI diagnoses by: (i) informing our participants that the AI outperforms the human doctor, and (ii) nudging them to prefer AI diagnoses in a choice between AI and human doctors. Results indicate overall lower trust in AI, as well as for diagnoses of high-risk diseases. Participants trusted AI doctors less than humans for first diagnoses, and they were also less likely to trust a second opinion from an AI doctor for high risk diseases. Surprisingly, results highlight that people have comparable standards of performance for AI and human doctors and that trust in AI does not increase when people are told the AI outperforms the human doctor. Importantly, we find that the gap in trust between AI and human diagnoses is eliminated when people are nudged to select AI in a free-choice paradigm between human and AI diagnoses, with trust for AI diagnoses significantly increased when participants could choose their doctor. These findings isolate control over one's medical practitioner as a valid candidate for future trust-related medical diagnosis and highlight a solid potential path to smooth acceptance of AI diagnoses amongst patients.",,
