Paper title,Takeaway from abstract,Source,Year,Citations,Authors,Journal,Influential citations,DOI,DOI URL,Semantic Scholar URL,PDF,Abstract,Takeaway suggests yes/no,Study type
Trustworthy AI: From Principles to Practices,"AI practitioners need to develop trustworthy AI systems that are robust, generalizable, explainable, transparent, reproducible, fair, private, and aligned with human values.",Search,2021,1,"Bo  Li, Peng  Qi, Bo  Liu, Shuai  Di, Jingen  Liu, Jiquan  Pei, Jinfeng  Yi, Bowen  Zhou",ArXiv,,,,https://semanticscholar.org/paper/c3689493757f90267908e776aeada9194fce55c7,,"Fast developing artificial intelligence (AI) technology has enabled various applied systems deployed in the real world, impacting people’s everyday lives. However, many current AI systems were found vulnerable to imperceptible attacks, biased against underrepresented groups, lacking in user privacy protection, etc., which not only degrades user experience but erodes the society’s trust in all AI systems. In this review, we strive to provide AI practitioners a comprehensive guide towards building trustworthy AI systems. We first introduce the theoretical framework of important aspects of AI trustworthiness, including robustness, generalization, explainability, transparency, reproducibility, fairness, privacy preservation, alignment with human values, and accountability. We then survey leading approaches in these aspects in the industry. To unify the current fragmented approaches towards trustworthy AI, we propose a systematic approach that considers the entire lifecycle of AI systems, ranging from data acquisition to model development, to development and deployment, finally to continuous monitoring and governance. In this framework, we offer concrete action items to practitioners and societal stakeholders (e.g., researchers and regulators) to improve AI trustworthiness. Finally, we identify key opportunities and challenges in the future development of trustworthy AI systems, where we identify the need for paradigm shift towards comprehensive trustworthy AI systems.",,Review
An agile framework for trustworthy AI,The AI High Level Expert Group (AI-HLEG) ethics guidelines present a list of requirements that trustworthy AI systems should meet.,Search,2020,2,"Stefan  Leijnen, Huib  Aldewereld, Rudy van Belkom, Roland  Bijvank, Roelant  Ossewaarde",NeHuAI@ECAI,,,,https://semanticscholar.org/paper/880049a16c8fea47dcfe07450668f5507db5e96d,,"From the article: The ethics guidelines put forward by the AI High Level Expert Group (AI-HLEG) present a list of seven key requirements that Human-centered, trustworthy AI systems should meet. These guidelines are useful for the evaluation of AI systems, but can be complemented by applied methods and tools for the development of trustworthy AI systems in practice. In this position paper we propose a framework for translating the AI-HLEG ethics guidelines into the specific context within which an AI system operates. This approach aligns well with a set of Agile principles commonly employed in software engineering. http://ceur-ws.org/Vol-2659/",,
How to achieve trustworthy artificial intelligence for health,"The EU's guidance leaves room for local, contextualized discretion in the global health sector.",Search,2020,15,"Kristine  Bærøe, Ainar  Miyata-Sturm, Edmund  Henden",Bulletin of the World Health Organization,,10.2471/BLT.19.237289,https://doi.org/10.2471/BLT.19.237289,https://semanticscholar.org/paper/0a3c92d6c4fa4670743fb13758916067e772a143,https://europepmc.org/articles/pmc7133476?pdf=render,"Abstract Artificial intelligence holds great promise in terms of beneficial, accurate and effective preventive and curative interventions. At the same time, there is also awareness of potential risks and harm that may be caused by unregulated developments of artificial intelligence. Guiding principles are being developed around the world to foster trustworthy development and application of artificial intelligence systems. These guidelines can support developers and governing authorities when making decisions about the use of artificial intelligence. The High-Level Expert Group on Artificial Intelligence set up by the European Commission launched the report Ethical guidelines for trustworthy artificial intelligence in2019. The report aims to contribute to reflections and the discussion on the ethics of artificial intelligence technologies also beyond the countries of the European Union (EU). In this paper, we use the global health sector as a case and argue that the EU’s guidance leaves too much room for local, contextualized discretion for it to foster trustworthy artificial intelligence globally. We point to the urgency of shared globalized efforts to safeguard against the potential harms of artificial intelligence technologies in health care.",,
Requirements for Trustworthy Artificial Intelligence - A Review,"The field of algorithmic decision-making, particularly Artificial Intelligence (AI), has been drastically changing.",Search,2020,8,"Davinder  Kaur, Suleyman  Uslu, Arjan  Durresi",NBiS,,10.1007/978-3-030-57811-4_11,https://doi.org/10.1007/978-3-030-57811-4_11,https://semanticscholar.org/paper/ab7f6628cbbafae1ce994929af2482efbd092d61,https://scholarworks.iupui.edu/bitstream/1805/28055/1/Kaur2020Requirements-AAM.pdf,"The field of algorithmic decision-making, particularly Artificial Intelligence (AI), has been drastically changing. With the availability of a massive amount of data and an increase in the processing power, AI systems have been used in a vast number of high-stake applications. So, it becomes vital to make these systems reliable and trustworthy. Different approaches have been proposed to make theses systems trustworthy. In this paper, we have reviewed these approaches and summarized them based on the principles proposed by the European Union for trustworthy AI. This review provides an overview of different principles that are important to make AI trustworthy.",,Review
The relationship between trust in AI and trustworthy machine learning technologies,"Trustworthiness technologies can support the required qualities of fair, explainable, auditable, and safe machine learning.",Search,2020,50,"Ehsan  Toreini, Mhairi  Aitken, Kovila  Coopamootoo, Karen  Elliott, Carlos Gonzalez Zelaya, Aad van Moorsel",FAT*,,10.1145/3351095.3372834,https://doi.org/10.1145/3351095.3372834,https://semanticscholar.org/paper/bd4cf5a6987ef0f39b7e4e88d59b3a3365abcc70,http://arxiv.org/pdf/1912.00782,"To design and develop AI-based systems that users and the larger public can justifiably trust, one needs to understand how machine learning technologies impact trust. To guide the design and implementation of trusted AI-based systems, this paper provides a systematic approach to relate considerations about trust from the social sciences to trustworthiness technologies proposed for AI-based services and products. We start from the ABI+ (Ability, Benevolence, Integrity, Predictability) framework augmented with a recently proposed mapping of ABI+ on qualities of technologies that support trust. We consider four categories of trustworthiness technologies for machine learning, namely these for Fairness, Explainability, Auditability and Safety (FEAS) and discuss if and how these support the required qualities. Moreover, trust can be impacted throughout the life cycle of AI-based systems, and we therefore introduce the concept of Chain of Trust to discuss trustworthiness technologies in all stages of the life cycle. In so doing we establish the ways in which machine learning technologies support trusted AI-based systems. Finally, FEAS has obvious relations with known frameworks and therefore we relate FEAS to a variety of international 'principled AI' policy and technology frameworks that have emerged in recent years.",,
Trust in Artificial Intelligence,"AI is being used for scheduling appointments, powering smart homes, recognizing people’s faces in photos, making health diagnoses, providing investment advice, and several other things.",Search,2018,14,Arathi  Sethumadhavan,Ergonomics in Design: The Quarterly of Human Factors Applications,,10.1177/1064804618818592,https://doi.org/10.1177/1064804618818592,https://semanticscholar.org/paper/94a43052c729c8e7e3f28c50c76e46d09ec95f62,https://journals.sagepub.com/doi/pdf/10.1177/1064804618818592,"Trust is fundamental to creating a lasting relationship with another human being. In our daily lives, we encounter several situations where we place trust on other humans such as bus drivers, colleagues, and even strangers. Trust in human-human teams is initially founded on the predictability of the trustee, and as the relationship between the trustor and the trustee progresses, dependability or integrity replaces predictability as the basis of trust (Hoff & Bashir, 2015). As artificial intelligence (AI) gets smarter and smarter, it is becoming an integral part of human lives. For example, AI is being used for scheduling appointments, powering smart homes, recognizing people’s faces in photos, making health diagnoses, providing investment advice, and several other things. As with a humanhuman team, trust is a necessary ingredient for human-AI partnerships. However, trust in human-human teams progresses in the reverse order from human-human teams (e.g., Hoff & Bashir, 2015). This is because humans initially assume that AI is near perfect. Therefore, in the initial stages, faith forms the essential constituent of trust, and as the number of exchanges between the human and the AI increases, faith is replaced by dependability and predictability. Trust in AI is considered a twodimensional construct comprising trust and distrust, where trust is associated with feelings of calmness and security and distrust involves fear and worry (Lyons, Stokes, Eschleman, Alarcon, & Barelka, 2011). Unarguably, trust is a complex social process with a variety of factors determining the extent to which humans trust AI agents (Hoff & Bashir, 2015; Lee & See, 2004). Specifically, in order to calibrate the right level of trust in AI, consider dispositional (i.e., user characteristics such as age, culture, gender, and personality), internal (e.g., user characteristics such as workload, mood, self-confidence, and working memory capacity), environmental (e.g., task difficulty, perceived risks and benefits, organizational setting), and learned factors (e.g., reputation of the AI, reliability, consistency, type and timing of errors made by the AI, and users’ experience with similar agents). Design factors (e.g., appearance, ease of use, communication style, and transparency of the AI) also affect perceptions of trust. For example, anthrophomorphizing is an effective way of establishing a long-term social bond between humans and AI agents, which is driven by the neurotransmitter and hormone, oxytocin (e.g., de Visser et al., 2017). Further, anthropomorphic agents also resist breakdown in trust compared to their counterpart non-anthropomorphic agents, presumably because anthropomorphic agents remind users of humans who are forgiven more easily for being imperfect in comparison to machine-like agents. Interestingly, there is also evidence that humans tend to disclose more information to AI therapists than human therapists. Transparency of the AI also helps to calibrate the right level of trust by enabling users to develop accurate mental models of the AI underpinnings (e.g., Balfe, Sharples, & Wilson, 2018). 818592 ERGXXX10.1177/1064804618818592ergonomics in designergonomics in design research-article2018",,
Trustworthy AI,The pursuit of responsible AI raises the ante on both the trustworthy computing and formal methods communities.,Search,2021,7,Jeannette M. Wing,Commun. ACM,,10.1145/3448248,https://doi.org/10.1145/3448248,https://semanticscholar.org/paper/33cf9b4d6c76f988380b1adff2c06c30010f93d3,https://dl.acm.org/doi/pdf/10.1145/3448248,The pursuit of responsible AI raises the ante on both the trustworthy computing and formal methods communities.,,
Trustworthy AI Development Guidelines for Human System Interaction,AI development guidelines can improve the user trust in AI systems to enhance human-AI interactions.,Search,2020,3,"Chathurika S. Wickramasinghe, Daniel L. Marino, Javier  Grandio, Milos  Manic",2020 13th International Conference on Human System Interaction (HSI),,10.1109/HSI49210.2020.9142644,https://doi.org/10.1109/HSI49210.2020.9142644,https://semanticscholar.org/paper/238fa66062114f39e404c40d0b1abc03b86e54bd,,"Artificial Intelligence (AI) is influencing almost all areas of human life. Even though these AI-based systems frequently provide state-of-the-art performance, humans still hesitate to develop, deploy, and use AI systems. The main reason for this is the lack of trust in AI systems caused by the deficiency of transparency of existing AI systems. As a solution, “Trustworthy AI” research area merged with the goal of defining guidelines and frameworks for improving user trust in AI systems, allowing humans to use them without fear. While trust in AI is an active area of research, very little work exists where the focus is to build human trust to improve the interactions between human and AI systems. In this paper, we provide a concise survey on concepts of trustworthy AI. Further, we present trustworthy AI development guidelines for improving the user trust to enhance the interactions between AI systems and humans, that happen during the AI system life cycle.",,
Trustworthy artificial intelligence,"Trustworthy AI bases on the idea that trust builds the foundation of societies, economies, and sustainable development.",Search,2021,21,"Scott  Thiebes, Sebastian  Lins, Ali  Sunyaev",Electron. Mark.,,10.1007/S12525-020-00441-4,https://doi.org/10.1007/S12525-020-00441-4,https://semanticscholar.org/paper/9da092d7c7674e96830f8d6713a9a4f8101f984c,https://link.springer.com/content/pdf/10.1007/s12525-020-00441-4.pdf,"Artificial intelligence (AI) brings forth many opportunities to contribute to the wellbeing of individuals and the advancement of economies and societies, but also a variety of novel ethical, legal, social, and technological challenges. Trustworthy AI (TAI) bases on the idea that trust builds the foundation of societies, economies, and sustainable development, and that individuals, organizations, and societies will therefore only ever be able to realize the full potential of AI, if trust can be established in its development, deployment, and use. With this article we aim to introduce the concept of TAI and its five foundational principles (1) beneficence, (2) non-maleficence, (3) autonomy, (4) justice, and (5) explicability. We further draw on these five principles to develop a data-driven research framework for TAI and demonstrate its utility by delineating fruitful avenues for future research, particularly with regard to the distributed ledger technology-based realization of TAI.",,
Can we trust AI? An empirical investigation of trust requirements and guide to successful AI adoption,"The factors that increase overall trust in AI are access to knowledge, transparency, explainability, certification, and self-imposed standards and guidelines.",Search,2021,2,"Patrick  Bedué, Albrecht  Fritzsche",,,10.1108/JEIM-06-2020-0233,https://doi.org/10.1108/JEIM-06-2020-0233,https://semanticscholar.org/paper/2590e2a851c6c9fc61029377c1e451afdb408004,,"Purpose Artificial intelligence (AI) fosters economic growth and opens up new directions for innovation. However, the diffusion of AI proceeds very slowly and falls behind, especially in comparison to other technologies. An important path leading to better adoption rates identified is trust-building. Particular requirements for trust and their relevance for AI adoption are currently insufficiently addressed.Design/methodology/approachTo close this gap, the authors follow a qualitative approach, drawing on the extended valence framework by assessing semi-structured interviews with experts from various companies.FindingsThe authors contribute to research by finding several subcategories for the three main trust dimensions ability, integrity and benevolence, thereby revealing fundamental differences for building trust in AI compared to more traditional technologies. In particular, the authors find access to knowledge, transparency, explainability, certification, as well as self-imposed standards and guidelines to be important factors that increase overall trust in AI.Originality/valueThe results show how the valence framework needs to be elaborated to become applicable to the AI context and provide further structural orientation to better understand AI adoption intentions. This may help decision-makers to identify further requirements or strategies to increase overall trust in their AI products, creating competitive and operational advantage.",,
Trust in Artificial Intelligence: Australian Insights,Artificial Intelligence (AI) is the cornerstone technology of the Fourth Industrial Revolution and is enabling rapid innovation with many potential benefits for Australian society.,Search,2020,5,"Steve  Lockey, Nicole  Gillespie, Caitlin  Curtis",,,10.14264/b32f129,https://doi.org/10.14264/b32f129,https://semanticscholar.org/paper/6c2714f81bc323851052920d240bc21b98e2a9f8,https://espace.library.uq.edu.au/view/UQ:b32f129/LockeyGillespieCurtis_Trust_In_AI.pdf,"Artificial Intelligence (AI) is the cornerstone technology of the Fourth Industrial Revolution and is enabling rapid innovation with many potential benefits for Australian society (e.g. enhanced healthcare diagnostics, transportation optimisation) and business (e.g. enhanced efficiency and competitiveness). The COVID-19 pandemic has accelerated the uptake of advanced technology, and investment in AI continues to grow exponentially.AI also poses considerable risks and challenges to society which raises concerns about whether AI systems are worthy of trust. These concerns have been fuelled by high profile cases of AI use that were biased, discriminatory, manipulative, unlawful, or violated privacy or other human rights. Without public confidence that AI is being developed and used in an ethical and trustworthy manner, it will not be trusted and its full potential will not be realised. To echo the sentiment of Dr Alan Finkel AO, Australia’s Chief Scientist, acceptance of AI rests on “the essential foundation of trust”. Are we capable of extending our trust to AI? This national survey is the first to take a deep dive into answering this question and understanding community trust and expectations in relation to AI. To do this, we surveyed a nationally representative sample of over 2,500 Australian citizens in June to July 2020. Our findings provide important and timely research insights into the public’s trust and attitudes towards AI and lay out a pathway for strengthening trust and acceptance of AI systems.Key findings include:              - Trust is central to the acceptance of AI, and is influenced by four key drivers;              - Australians have low trust in AI systems but generally ‘accept’ or ‘tolerate’ AI;              - Australians expect AI to be regulated and carefully managed;              - Australians expect organisations to uphold the principles of trustworthy AI;              - Australians feel comfortable with some but not all uses of AI at work;              - Australians want to know more about AI but currently have low awareness and understanding of AI and its uses.We draw out the implications of the findings for government, business and NGOs and provide a roadmap to enhancing public trust in AI highlighting three key actions:              - Live up to Australian’s expectations of trustworthy AI              - Strengthen the regulatory framework for governing AI              - Strengthen Australia’s AI literacy",,
Establishing the rules for building trustworthy AI,The European Commission’s report ‘Ethics guidelines for trustworthy AI’ facilitates international support for AI solutions that are good for humanity and the environment.,Search,2019,67,Luciano  Floridi,Nature Machine Intelligence,,10.1038/S42256-019-0055-Y,https://doi.org/10.1038/S42256-019-0055-Y,https://semanticscholar.org/paper/dc44e2be0f85b6225f05390c570885337a99ef83,https://philpapers.org/archive/FLOETR.pdf,"The European Commission’s report ‘Ethics guidelines for trustworthy AI’ provides a clear benchmark to evaluate the responsible development of AI systems, and facilitates international support for AI solutions that are good for humanity and the environment, says Luciano Floridi.",,
Opening the software engineering toolbox for the assessment of trustworthy AI,Software engineering and testing practices can be used to assess AI systems for trustworthiness.,Search,2020,2,"Mohit Kumar Ahuja, Mohamed-Bachir  Belaid, Pierre  Bernab'e, Mathieu  Collet, Arnaud  Gotlieb, Chhagan  Lal, Dusica  Marijan, Sagar  Sen, Aizaz  Sharif, Helge  Spieker",NeHuAI@ECAI,,,,https://semanticscholar.org/paper/3b0ff6bd000e9c615d024614343f2c1cf12bf124,,"Trustworthiness is a central requirement for the acceptance and success of human-centered artificial intelligence (AI). To deem an AI system as trustworthy, it is crucial to assess its behaviour and characteristics against a gold standard of Trustworthy AI, consisting of guidelines, requirements, or only expectations. While AI systems are highly complex, their implementations are still based on software. The software engineering community has a long-established toolbox for the assessment of software systems, especially in the context of software testing. In this paper, we argue for the application of software engineering and testing practices for the assessment of trustworthy AI. We make the connection between the seven key requirements as defined by the European Commission's AI high-level expert group and established procedures from software engineering and raise questions for future work.",,
Applied artificial intelligence and trust—The case of autonomous vehicles and medical assistance devices,Firms must foster trust regarding applied AI in order to increase trust in the technology.,Search,2016,271,"Monika  Hengstler, Ellen  Enkel, Selina  Duelli",,,10.1016/J.TECHFORE.2015.12.014,https://doi.org/10.1016/J.TECHFORE.2015.12.014,https://semanticscholar.org/paper/203b30269d27e158cd26bd1f47c3207f52e6aec8,,"Automation with inherent artificial intelligence (AI) is increasingly emerging in diverse applications, for instance, autonomous vehicles and medical assistance devices. However, despite their growing use, there is still noticeable skepticism in society regarding these applications. Drawing an analogy from human social interaction, the concept of trust provides a valid foundation for describing the relationship between humans and automation. Accordingly, this paper explores how firms systematically foster trust regarding applied AI. Based on empirical analysis using nine case studies in the transportation and medical technology industries, our study illustrates the dichotomous constitution of trust in applied AI. Concretely, we emphasize the symbiosis of trust in the technology as well as in the innovating firm and its communication about the technology. In doing so, we provide tangible approaches to increase trust in the technology and illustrate the necessity of a democratic development process for applied AI.",,
Trust in Distributed Artificial Intelligence,Trust allows interactions between agents where there may have been no effective interaction possible before trust.,Search,1992,90,Stephen  Marsh,MAAMAW,,10.1007/3-540-58266-5_6,https://doi.org/10.1007/3-540-58266-5_6,https://semanticscholar.org/paper/6d296cd0ddaccb6d01aa197c9ba5a04afee2d399,,"A discussion of trust is presented which focuses on multiagent systems, from the point of view of one agent in a system. The roles trust plays in various forms of interaction are considered, with the view that trust allows interactions between agents where there may have been no effective interaction possible before trust. Trust allows parties to acknowledge that, whilst there is a risk in relationships with potentially malevolent agents, some form of interaction may produce benefits, where no interaction at all may not. In addition, accepting the risk allows the trusting agent to prepare itself for possibly irresponsible or untrustworthy behaviour, thus minimizing the potential damage caused. A formalism is introduced to clarify these notions, and to permit computer simulations. An important contribution of this work is that the formalism is not allen-compassing: there are some notions of trust that are excluded. What it describes is a specific view of trust.",,
