Paper title,Takeaway from abstract,Source,Year,Citations,Authors,Journal,Influential citations,DOI,DOI URL,Semantic Scholar URL,PDF,Abstract,Takeaway suggests yes/no,Study type
An agile framework for trustworthy AI,The AI High Level Expert Group (AI-HLEG) ethics guidelines present a list of requirements that trustworthy AI systems should meet.,Search,2020,2,"Stefan  Leijnen, Huib  Aldewereld, Rudy van Belkom, Roland  Bijvank, Roelant  Ossewaarde",NeHuAI@ECAI,,,,https://semanticscholar.org/paper/880049a16c8fea47dcfe07450668f5507db5e96d,,"From the article: The ethics guidelines put forward by the AI High Level Expert Group (AI-HLEG) present a list of seven key requirements that Human-centered, trustworthy AI systems should meet. These guidelines are useful for the evaluation of AI systems, but can be complemented by applied methods and tools for the development of trustworthy AI systems in practice. In this position paper we propose a framework for translating the AI-HLEG ethics guidelines into the specific context within which an AI system operates. This approach aligns well with a set of Agile principles commonly employed in software engineering. http://ceur-ws.org/Vol-2659/",,
Establishing the rules for building trustworthy AI,The European Commission’s report ‘Ethics guidelines for trustworthy AI’ facilitates international support for AI solutions that are good for humanity and the environment.,Search,2019,67,Luciano  Floridi,Nature Machine Intelligence,,10.1038/S42256-019-0055-Y,https://doi.org/10.1038/S42256-019-0055-Y,https://semanticscholar.org/paper/dc44e2be0f85b6225f05390c570885337a99ef83,https://philpapers.org/archive/FLOETR.pdf,"The European Commission’s report ‘Ethics guidelines for trustworthy AI’ provides a clear benchmark to evaluate the responsible development of AI systems, and facilitates international support for AI solutions that are good for humanity and the environment, says Luciano Floridi.",,
Comments on the “Draft Ethics Guidelines for Trustworthy AI” by the High-LevelExpert Group on Artificial Intelligence.,The European Commission appointed the High-Level Expert Group on Artificial Intelligence.,Search,2019,49,Ninja  Marnau,,,,,https://semanticscholar.org/paper/01040c2897ea82bb801931dbfe8a85a3b64d2e7f,,"The European Commission appointed the High-Level Expert Group on Artificial Intelligence (AI HLEG). The AI HLEG has the objective to support the implementation of the European strategy on Artificial Intelligence. This will include the elaboration of recommendations on future-related policy development and on ethical, legal and societal issues related to AI. In January 2019, the Commission asked stakeholders for comments on the AI HLEG’s “Draft Ethics Guidelines for Trustworthy AI”. CISPA submitted the following comments and remarks in the Stakeholders’ Consultation.",,
Trustworthy AI Development Guidelines for Human System Interaction,AI development guidelines can improve the user trust in AI systems to enhance human-AI interactions.,Search,2020,3,"Chathurika S. Wickramasinghe, Daniel L. Marino, Javier  Grandio, Milos  Manic",2020 13th International Conference on Human System Interaction (HSI),,10.1109/HSI49210.2020.9142644,https://doi.org/10.1109/HSI49210.2020.9142644,https://semanticscholar.org/paper/238fa66062114f39e404c40d0b1abc03b86e54bd,,"Artificial Intelligence (AI) is influencing almost all areas of human life. Even though these AI-based systems frequently provide state-of-the-art performance, humans still hesitate to develop, deploy, and use AI systems. The main reason for this is the lack of trust in AI systems caused by the deficiency of transparency of existing AI systems. As a solution, “Trustworthy AI” research area merged with the goal of defining guidelines and frameworks for improving user trust in AI systems, allowing humans to use them without fear. While trust in AI is an active area of research, very little work exists where the focus is to build human trust to improve the interactions between human and AI systems. In this paper, we provide a concise survey on concepts of trustworthy AI. Further, we present trustworthy AI development guidelines for improving the user trust to enhance the interactions between AI systems and humans, that happen during the AI system life cycle.",,
The EU Approach to Ethics Guidelines for Trustworthy Artificial Intelligence,The EU Ethics Guidelines for Trustworthy Artificial Intelligence are written to guide AI practitioners.,Search,2019,56,Nathalie A. Smuha,Computer Law Review International,,10.9785/cri-2019-200402,https://doi.org/10.9785/cri-2019-200402,https://semanticscholar.org/paper/a00ee7ae4642b986b622e0f48c845e79707b707b,https://lirias.kuleuven.be/bitstream/123456789/640572/2/EU%20Approach%20for%20Trustworthy%20AI%20-%20a%20continuous%20journey.pdf,"As part of its European strategy for Artificial Intelligence (AI), and as a response to the increasing ethical questions raised by this technology, the European Commission established an independent High-Level Expert Group on Artificial Intelligence (AI HLEG) in June 2018. The group was tasked to draft two deliverables: AI Ethics Guidelines and Policy and Investment Recommendations. Nine months later, its first deliverable was published, putting forward a comprehensive framework to achieve “Trustworthy AI” by offering ethical guidance to AI practitioners. This paper dives into the work carried out by the group, focusing in particular on its AI Ethics Guidelines. First, this paper clarifies the context that led to the creation of the AI HLEG and its mandate (I.). Subsequently, it elaborates on the Guidelines’ aim and purpose (II.), and analyses the Guidelines’ drafting process (III.). Particular focus is given to the questions surrounding the respective role played by ethics and law in the AI governance landscape (IV.), as well as some of the challenges that had to be overcome throughout the process (V.). Finally, this paper places the Guidelines in an international context, and sets out the next steps (VI.) ahead on the journey towards an appropriate governance framework for AI (VII.).",,
Trustworthy AI and Corporate Governance – The EU’s Ethics Guidelines For Trustworthy Artificial Intelligence from a Company Law Perspective,The Ethics Guidelines for Trustworthy AI written by the EU provide a useful starting point for directing businesses towards establishing trustworthy AI.,Search,2020,5,"Eleanore  Hickman, Martin  Petrin",,,10.2139/ssrn.3607225,https://doi.org/10.2139/ssrn.3607225,https://semanticscholar.org/paper/72b39cf03173e4ced50e54873dac32258bbbfe16,,"AI will change many aspects of the world we live in, including the way corporations are governed. Many efficiencies and improvements are likely, but there are also potential dangers, including the threat of harmful impacts on third parties, discriminatory practices, data and privacy breaches, fraudulent practices and even ‘rogue AI’. To address these dangers, the EU published its 'Ethics Guidelines for Trustworthy AI’. The Guidelines produce seven principles from its four foundational pillars of respect for human autonomy, prevention of harm, fairness and explicability.

If implemented by business, the impact on corporate governance will be substantial. Fundamental questions at the intersection of ethics and law are considered but, because the Guidelines only address the former without much reference to the latter, their practical application is challenging for business. Further, while they promote many positive corporate governance principles, it is clear that the Guidelines' general nature leaves many questions and concerns unanswered.

In this paper we examine the potential significance and impact of the Guidelines on selected corporate law and governance issues. We conclude that more specificity is needed in relation to how the principles therein will harmonise with company law rules and governance practices. However, despite their imperfections, until harder legislative instruments emerge, the Guidelines provide a useful starting point for directing businesses towards establishing trustworthy AI.",,
Trustworthy AI and Corporate Governance: The EU’s Ethics Guidelines for Trustworthy Artificial Intelligence from a Company Law Perspective,The EU Ethics Guidelines for Trustworthy Artificial Intelligence provide a useful starting point for directing businesses towards establishing trustworthy AI.,Search,2021,1,"Eleanore  Hickman, Martin  Petrin",European Business Organization Law Review,,10.1007/s40804-021-00224-0,https://doi.org/10.1007/s40804-021-00224-0,https://semanticscholar.org/paper/89b6823aea0f7306bd2ee9a4dac7206256ecd5cc,https://link.springer.com/content/pdf/10.1007/s40804-021-00224-0.pdf,"AI will change many aspects of the world we live in, including the way corporations are governed. Many efficiencies and improvements are likely, but there are also potential dangers, including the threat of harmful impacts on third parties, discriminatory practices, data and privacy breaches, fraudulent practices and even ‘rogue AI’. To address these dangers, the EU published ‘The Expert Group’s Policy and Investment Recommendations for Trustworthy AI’ (the Guidelines). The Guidelines produce seven principles from its four foundational pillars of respect for human autonomy, prevention of harm, fairness, and explicability. If implemented by business, the impact on corporate governance will be substantial. Fundamental questions at the intersection of ethics and law are considered, but because the Guidelines only address the former without (much) reference to the latter, their practical application is challenging for business. Further, while they promote many positive corporate governance principles—including a stakeholder-oriented (‘human-centric’) corporate purpose and diversity, non-discrimination, and fairness—it is clear that their general nature leaves many questions and concerns unanswered. In this paper we examine the potential significance and impact of the Guidelines on selected corporate law and governance issues. We conclude that more specificity is needed in relation to how the principles therein will harmonise with company law rules and governance principles. However, despite their imperfections, until harder legislative instruments emerge, the Guidelines provide a useful starting point for directing businesses towards establishing trustworthy AI.",,
Can we trust AI? An empirical investigation of trust requirements and guide to successful AI adoption,"The factors that increase overall trust in AI are access to knowledge, transparency, explainability, certification, and self-imposed standards and guidelines.",Search,2021,2,"Patrick  Bedué, Albrecht  Fritzsche",,,10.1108/JEIM-06-2020-0233,https://doi.org/10.1108/JEIM-06-2020-0233,https://semanticscholar.org/paper/2590e2a851c6c9fc61029377c1e451afdb408004,,"Purpose Artificial intelligence (AI) fosters economic growth and opens up new directions for innovation. However, the diffusion of AI proceeds very slowly and falls behind, especially in comparison to other technologies. An important path leading to better adoption rates identified is trust-building. Particular requirements for trust and their relevance for AI adoption are currently insufficiently addressed.Design/methodology/approachTo close this gap, the authors follow a qualitative approach, drawing on the extended valence framework by assessing semi-structured interviews with experts from various companies.FindingsThe authors contribute to research by finding several subcategories for the three main trust dimensions ability, integrity and benevolence, thereby revealing fundamental differences for building trust in AI compared to more traditional technologies. In particular, the authors find access to knowledge, transparency, explainability, certification, as well as self-imposed standards and guidelines to be important factors that increase overall trust in AI.Originality/valueThe results show how the valence framework needs to be elaborated to become applicable to the AI context and provide further structural orientation to better understand AI adoption intentions. This may help decision-makers to identify further requirements or strategies to increase overall trust in their AI products, creating competitive and operational advantage.",,
Guidelines for Trustworthy AI application in clinical trials,The European Commission established the High-Level Expert Group on Artificial Intelligence (AI HLEG).,Search,2020,,"N  Leventi, A  Vodenitcharova, K  Popova",,,10.1093/eurpub/ckaa165.806,https://doi.org/10.1093/eurpub/ckaa165.806,https://semanticscholar.org/paper/29898969890b3d4d8a5813a6750d308b3fb7117e,https://academic.oup.com/eurpub/article-pdf/30/Supplement_5/ckaa165.806/33817815/ckaa165.806.pdf,"Innovative information technologies (IIT) like artificial intelligence (AI), big data, etc. promise to support individual patient care, and promote public health. Their use raises ethical, social and legal issues. Here we demonstrate how the guidelines for trustworthy AI, can assist to answer those ethical issues in the case of clinical trials (CT).

In 2018 the European Commission established the High-Level Expert Group on Artificial Intelligence (AI HLEG). The group proposed Guidelines to promote Trustworthy AI, with three components, which should be met throughout the system's entire life cycle, as it should be lawful, ethical and robust.

Trustworthiness is a prerequisite for people and societies to develop, and use AI systems. We used a focus group methodology to explore how the guidelines for trustworthy AI can assist to answer the ethical issues that rise by the application of AI in CTs.

The discussion was directed to the seven requirements for trustworthy AI in CTs, by questions like:

Are they relevant in CTs as a whole? Would they be applicable to the use of IIT as AI in CTs? Are you currently applying part, or all, of the proposed list? In the future, would you attach some, or all, of the proposed list? Is the administrative burden of applying the requirements justified by the effect?

It was recommended that:

the guidelines are relevant in the conduct of the CT; planning and implementation of CTs using IIT, should take them into account; ethical aspects and challenges are of the utmost importance; the proposed list is a very comprehensive framework; particular attention should be paid where more vulnerable groups are affected; the administrative burden is acceptable, as the effect exceeds the resources invested.

IIT are becoming increasingly important in medicine, and requirements for trustworthy IIT, and AI are necessary. Appropriate instrument in the case of the CTs are the provided by AI HLEG guidelines.",,
How to achieve trustworthy artificial intelligence for health,"The EU's guidance leaves room for local, contextualized discretion in the global health sector.",Search,2020,15,"Kristine  Bærøe, Ainar  Miyata-Sturm, Edmund  Henden",Bulletin of the World Health Organization,,10.2471/BLT.19.237289,https://doi.org/10.2471/BLT.19.237289,https://semanticscholar.org/paper/0a3c92d6c4fa4670743fb13758916067e772a143,https://europepmc.org/articles/pmc7133476?pdf=render,"Abstract Artificial intelligence holds great promise in terms of beneficial, accurate and effective preventive and curative interventions. At the same time, there is also awareness of potential risks and harm that may be caused by unregulated developments of artificial intelligence. Guiding principles are being developed around the world to foster trustworthy development and application of artificial intelligence systems. These guidelines can support developers and governing authorities when making decisions about the use of artificial intelligence. The High-Level Expert Group on Artificial Intelligence set up by the European Commission launched the report Ethical guidelines for trustworthy artificial intelligence in2019. The report aims to contribute to reflections and the discussion on the ethics of artificial intelligence technologies also beyond the countries of the European Union (EU). In this paper, we use the global health sector as a case and argue that the EU’s guidance leaves too much room for local, contextualized discretion for it to foster trustworthy artificial intelligence globally. We point to the urgency of shared globalized efforts to safeguard against the potential harms of artificial intelligence technologies in health care.",,
Opening the software engineering toolbox for the assessment of trustworthy AI,The software engineering community has a long-established toolbox for the assessment of software systems.,Search,2020,2,"Mohit Kumar Ahuja, Mohamed-Bachir  Belaid, Pierre  Bernab'e, Mathieu  Collet, Arnaud  Gotlieb, Chhagan  Lal, Dusica  Marijan, Sagar  Sen, Aizaz  Sharif, Helge  Spieker",NeHuAI@ECAI,,,,https://semanticscholar.org/paper/3b0ff6bd000e9c615d024614343f2c1cf12bf124,,"Trustworthiness is a central requirement for the acceptance and success of human-centered artificial intelligence (AI). To deem an AI system as trustworthy, it is crucial to assess its behaviour and characteristics against a gold standard of Trustworthy AI, consisting of guidelines, requirements, or only expectations. While AI systems are highly complex, their implementations are still based on software. The software engineering community has a long-established toolbox for the assessment of software systems, especially in the context of software testing. In this paper, we argue for the application of software engineering and testing practices for the assessment of trustworthy AI. We make the connection between the seven key requirements as defined by the European Commission's AI high-level expert group and established procedures from software engineering and raise questions for future work.",,
Trustworthy AI Implementation (TAII) Framework for AI Systems,,Search,2021,1,Josef  Baker-Brunnbauer,,,10.2139/SSRN.3796799,https://doi.org/10.2139/SSRN.3796799,https://semanticscholar.org/paper/3337ff3dd257ae6cb5d276e34aa06f190ab06265,,"Companies and their stakeholder need practical tools and implementation guidelines besides abstract frameworks to kick off the realization of Artificial Intelligence (AI) ethics. Based on my previous research outcome AI development companies are still in the beginning of this process or have not even started yet. How is it possible to decrease the entry level barrier to kickoff AI ethics implementation? I tackle this question by combining AI ethics research with previous research findings to create the Trustworthy AI Implementation (TAII) framework. A literature review was conducted and that specifies the research and implementation status for each process step. The aim is to kickoff AI ethics and to transfer research and abstract guidelines from academia to business. The TAII process generates a meta perspective on the systemic dependencies of ethics for the company ecosystem. It generates orienteering for the AI ethics kickoff without requiring a deep background in philosophy and considers perspectives of social impact outside the software and data engineering setting. Depending on the legal regulation or area of application, the TAII process can be adapted and used with different regulations and ethical principles.",,Review
The relationship between trust in AI and trustworthy machine learning technologies,"Trustworthiness technologies can support the required qualities of fair, explainable, auditable, and safe machine learning.",Search,2020,50,"Ehsan  Toreini, Mhairi  Aitken, Kovila  Coopamootoo, Karen  Elliott, Carlos Gonzalez Zelaya, Aad van Moorsel",FAT*,,10.1145/3351095.3372834,https://doi.org/10.1145/3351095.3372834,https://semanticscholar.org/paper/bd4cf5a6987ef0f39b7e4e88d59b3a3365abcc70,http://arxiv.org/pdf/1912.00782,"To design and develop AI-based systems that users and the larger public can justifiably trust, one needs to understand how machine learning technologies impact trust. To guide the design and implementation of trusted AI-based systems, this paper provides a systematic approach to relate considerations about trust from the social sciences to trustworthiness technologies proposed for AI-based services and products. We start from the ABI+ (Ability, Benevolence, Integrity, Predictability) framework augmented with a recently proposed mapping of ABI+ on qualities of technologies that support trust. We consider four categories of trustworthiness technologies for machine learning, namely these for Fairness, Explainability, Auditability and Safety (FEAS) and discuss if and how these support the required qualities. Moreover, trust can be impacted throughout the life cycle of AI-based systems, and we therefore introduce the concept of Chain of Trust to discuss trustworthiness technologies in all stages of the life cycle. In so doing we establish the ways in which machine learning technologies support trusted AI-based systems. Finally, FEAS has obvious relations with known frameworks and therefore we relate FEAS to a variety of international 'principled AI' policy and technology frameworks that have emerged in recent years.",,
Trustworthy AI,The pursuit of responsible AI raises the ante on both the trustworthy computing and formal methods communities.,Search,2021,7,Jeannette M. Wing,Commun. ACM,,10.1145/3448248,https://doi.org/10.1145/3448248,https://semanticscholar.org/paper/33cf9b4d6c76f988380b1adff2c06c30010f93d3,https://dl.acm.org/doi/pdf/10.1145/3448248,The pursuit of responsible AI raises the ante on both the trustworthy computing and formal methods communities.,,
Trust in Artificial Intelligence,,Search,2018,14,Arathi  Sethumadhavan,Ergonomics in Design: The Quarterly of Human Factors Applications,,10.1177/1064804618818592,https://doi.org/10.1177/1064804618818592,https://semanticscholar.org/paper/94a43052c729c8e7e3f28c50c76e46d09ec95f62,https://journals.sagepub.com/doi/pdf/10.1177/1064804618818592,"Trust is fundamental to creating a lasting relationship with another human being. In our daily lives, we encounter several situations where we place trust on other humans such as bus drivers, colleagues, and even strangers. Trust in human-human teams is initially founded on the predictability of the trustee, and as the relationship between the trustor and the trustee progresses, dependability or integrity replaces predictability as the basis of trust (Hoff & Bashir, 2015). As artificial intelligence (AI) gets smarter and smarter, it is becoming an integral part of human lives. For example, AI is being used for scheduling appointments, powering smart homes, recognizing people’s faces in photos, making health diagnoses, providing investment advice, and several other things. As with a humanhuman team, trust is a necessary ingredient for human-AI partnerships. However, trust in human-human teams progresses in the reverse order from human-human teams (e.g., Hoff & Bashir, 2015). This is because humans initially assume that AI is near perfect. Therefore, in the initial stages, faith forms the essential constituent of trust, and as the number of exchanges between the human and the AI increases, faith is replaced by dependability and predictability. Trust in AI is considered a twodimensional construct comprising trust and distrust, where trust is associated with feelings of calmness and security and distrust involves fear and worry (Lyons, Stokes, Eschleman, Alarcon, & Barelka, 2011). Unarguably, trust is a complex social process with a variety of factors determining the extent to which humans trust AI agents (Hoff & Bashir, 2015; Lee & See, 2004). Specifically, in order to calibrate the right level of trust in AI, consider dispositional (i.e., user characteristics such as age, culture, gender, and personality), internal (e.g., user characteristics such as workload, mood, self-confidence, and working memory capacity), environmental (e.g., task difficulty, perceived risks and benefits, organizational setting), and learned factors (e.g., reputation of the AI, reliability, consistency, type and timing of errors made by the AI, and users’ experience with similar agents). Design factors (e.g., appearance, ease of use, communication style, and transparency of the AI) also affect perceptions of trust. For example, anthrophomorphizing is an effective way of establishing a long-term social bond between humans and AI agents, which is driven by the neurotransmitter and hormone, oxytocin (e.g., de Visser et al., 2017). Further, anthropomorphic agents also resist breakdown in trust compared to their counterpart non-anthropomorphic agents, presumably because anthropomorphic agents remind users of humans who are forgiven more easily for being imperfect in comparison to machine-like agents. Interestingly, there is also evidence that humans tend to disclose more information to AI therapists than human therapists. Transparency of the AI also helps to calibrate the right level of trust by enabling users to develop accurate mental models of the AI underpinnings (e.g., Balfe, Sharples, & Wilson, 2018). 818592 ERGXXX10.1177/1064804618818592ergonomics in designergonomics in design research-article2018",,
