Paper title,Takeaway from abstract,Source,Year,Citations,Authors,Journal,Influential citations,DOI,DOI URL,Semantic Scholar URL,PDF,Abstract,Takeaway suggests yes/no,Study type
Co-Designing Checklists to Understand Organizational Challenges and Opportunities around Fairness in AI,Organizations may misuse AI ethics checklists if they are not grounded in practitioners' needs.,Search,2020,92,"Michael A. Madaio, Luke  Stark, Jennifer Wortman Vaughan, Hanna M. Wallach",CHI,,10.1145/3313831.3376445,https://doi.org/10.1145/3313831.3376445,https://semanticscholar.org/paper/58bb221c1e375f254826b7b7341f74057e87676c,https://dl.acm.org/doi/pdf/10.1145/3313831.3376445,"Many organizations have published principles intended to guide the ethical development and deployment of AI systems; however, their abstract nature makes them difficult to operationalize. Some organizations have therefore produced AI ethics checklists, as well as checklists for more specific concepts, such as fairness, as applied to AI systems. But unless checklists are grounded in practitioners' needs, they may be misused. To understand the role of checklists in AI ethics, we conducted an iterative co-design process with 48 practitioners, focusing on fairness. We co-designed an AI fairness checklist and identified desiderata and concerns for AI fairness checklists in general. We found that AI fairness checklists could provide organizational infrastructure for formalizing ad-hoc processes and empowering individual advocates. We highlight aspects of organizational culture that may impact the efficacy of AI fairness checklists, and suggest future design directions.",,
Lessons learned from AI ethics principles for future actions,AI ethics is urgently calling for tangible action to move from high-level abstractions and conceptual arguments towards applying ethics in practice and creating accountability mechanisms.,Search,2021,17,Merve  Hickok,AI Ethics,,10.1007/s43681-020-00008-1,https://doi.org/10.1007/s43681-020-00008-1,https://semanticscholar.org/paper/eb22e505d84b31f52a5bd8bd973f89711891e836,https://link.springer.com/content/pdf/10.1007/s43681-020-00008-1.pdf,"As the use of artificial intelligence (AI) systems became significantly more prevalent in recent years, the concerns on how these systems collect, use and process big data also increased. To address these concerns and advocate for ethical and responsible development and implementation of AI, non-governmental organizations (NGOs), research centers, private companies, and governmental agencies published more than 100 AI ethics principles and guidelines. This first wave was followed by a series of suggested frameworks, tools, and checklists that attempt a technical fix to issues brought up in the high-level principles. Principles are important to create a common understanding for priorities and are the groundwork for future governance and opportunities for innovation. However, a review of these documents based on their country of origin and funding entities shows that private companies from US-West axis dominate the conversation. Several cases surfaced in the meantime which demonstrate biased algorithms and their impact on individuals and society. The field of AI ethics is urgently calling for tangible action to move from high-level abstractions and conceptual arguments towards applying ethics in practice and creating accountability mechanisms. However, lessons must be learned from the shortcomings of AI ethics principles to ensure the future investments, collaborations, standards, codes or legislation reflect the diversity of voices and incorporate the experiences of those who are already impacted by the biased algorithms.",,Review
The global landscape of AI ethics guidelines,A global convergence is emerging around five ethical principles with substantial divergence in implementation.,Search,2019,642,"Anna  Jobin, Marcello  Ienca, Effy  Vayena",Nat. Mach. Intell.,,10.1038/S42256-019-0088-2,https://doi.org/10.1038/S42256-019-0088-2,https://semanticscholar.org/paper/35ebed28c967acbfe38fa757f4e7023d075beaeb,http://arxiv.org/pdf/1906.11668,"In the past five years, private companies, research institutions and public sector organizations have issued principles and guidelines for ethical artificial intelligence (AI). However, despite an apparent agreement that AI should be ‘ethical’, there is debate about both what constitutes ‘ethical AI’ and which ethical requirements, technical standards and best practices are needed for its realization. To investigate whether a global agreement on these questions is emerging, we mapped and analysed the current corpus of principles and guidelines on ethical AI. Our results reveal a global convergence emerging around five ethical principles (transparency, justice and fairness, non-maleficence, responsibility and privacy), with substantive divergence in relation to how these principles are interpreted, why they are deemed important, what issue, domain or actors they pertain to, and how they should be implemented. Our findings highlight the importance of integrating guideline-development efforts with substantive ethical analysis and adequate implementation strategies.As AI technology develops rapidly, it is widely recognized that ethical guidelines are required for safe and fair implementation in society. But is it possible to agree on what is ‘ethical AI’? A detailed analysis of 84 AI ethics reports around the world, from national and international organizations, companies and institutes, explores this question, finding a convergence around core principles but substantial divergence on practical implementation.",,
The Ethics of AI Ethics: An Evaluation of Guidelines,"Current advances in research, development, and application of artificial intelligence (AI) systems have yielded a far-reaching discourse on AI ethics.",Search,2020,272,Thilo  Hagendorff,Minds and Machines,,10.1007/s11023-020-09517-8,https://doi.org/10.1007/s11023-020-09517-8,https://semanticscholar.org/paper/f2cbdcd17dee5fb06b722fa009eaf691e8bfc73b,https://link.springer.com/content/pdf/10.1007/s11023-020-09517-8.pdf,"Current advances in research, development and application of artificial intelligence (AI) systems have yielded a far-reaching discourse on AI ethics. In consequence, a number of ethics guidelines have been released in recent years. These guidelines comprise normative principles and recommendations aimed to harness the “disruptive” potentials of new AI technologies. Designed as a semi-systematic evaluation, this paper analyzes and compares 22 guidelines, highlighting overlaps but also omissions. As a result, I give a detailed overview of the field of AI ethics. Finally, I also examine to what extent the respective ethical principles and values are implemented in the practice of research, development and application of AI systems—and how the effectiveness in the demands of AI ethics can be improved.",,Review
Artificial Intelligence: the global landscape of ethics guidelines,A global convergence is emerging around five ethical principles with substantive divergence in relation to how these principles are interpreted.,Search,2019,228,"Anna  Jobin, Marcello  Ienca, Effy  Vayena",ArXiv,,10.1038/s42256-019-0088-2,https://doi.org/10.1038/s42256-019-0088-2,https://semanticscholar.org/paper/7bf47af1f989c1a999d7dab24d86d19f13e8ba55,http://arxiv.org/pdf/1906.11668,"In the last five years, private companies, research institutions as well as public sector organisations have issued principles and guidelines for ethical AI, yet there is debate about both what constitutes ""ethical AI"" and which ethical requirements, technical standards and best practices are needed for its realization. To investigate whether a global agreement on these questions is emerging, we mapped and analyzed the current corpus of principles and guidelines on ethical AI. Our results reveal a global convergence emerging around five ethical principles (transparency, justice and fairness, non-maleficence, responsibility and privacy), with substantive divergence in relation to how these principles are interpreted; why they are deemed important; what issue, domain or actors they pertain to; and how they should be implemented. Our findings highlight the importance of integrating guideline-development efforts with substantive ethical analysis and adequate implementation strategies.",,
Ethics in artificial intelligence: introduction to the special issue,The development of intelligent systems must include ethical considerations to ensure human flourishing and wellbeing.,Search,2018,129,Virginia  Dignum,Ethics and Information Technology,,10.1007/s10676-018-9450-z,https://doi.org/10.1007/s10676-018-9450-z,https://semanticscholar.org/paper/6b77b4235bd455cf6df68cfa4fe4e2aa9401d06c,https://link.springer.com/content/pdf/10.1007%2Fs10676-018-9450-z.pdf,"Recent developments in Artificial Intelligence (AI) have generated a steep interest from media and general public. As AI systems (e.g. robots, chatbots, avatars and other intelligent agents) are moving from being perceived as a tool to being perceived as autonomous agents and team-mates, an important focus of research and development is understanding the ethical impact of these systems. What does it mean for an AI system to make a decision? What are the moral, societal and legal consequences of their actions and decisions? Can an AI system be held accountable for its actions? How can these systems be controlled once their learning capabilities bring them into states that are possibly only remotely linked to their initial, designed, setup? Should such autonomous innovation in commercial systems even be allowed, and how should use and development be regulated? These and many other related questions are currently the focus of much attention. The way society and our systems will be able to deal with these questions will for a large part determine our level of trust, and ultimately, the impact of AI in society, and the existence of AI. Contrary to the frightening images of a dystopic future in media and popular fiction, where AI systems dominate the world and is mostly concerned with warfare, AI is already changing our daily lives mostly in ways that improve human health, safety, and productivity (Stone et al. 2016). This is the case in domain such as transportation; service robots; health-care; education; public safety and security; and entertainment. Nevertheless, and in order to ensure that those dystopic futures do not become reality, these systems must be introduced in ways that build trust and understanding, and respect human and civil rights. The need for ethical considerations in the development of intelligent interactive systems is becoming one of the main influential areas of research in the last few years, and has led to several initiatives both from researchers as from practitioners, including the IEEE initiative on Ethics of Autonomous Systems1, the Foundation for Responsible Robotics2, and the Partnership on AI3 amongst several others. As the capabilities for autonomous decision making grow, perhaps the most important issue to consider is the need to rethink responsibility (Dignum 2017). Whatever their level of autonomy and social awareness and their ability to learn, AI systems are artefacts, constructed by people to fulfil some goals. Theories, methods, algorithms are needed to integrate societal, legal and moral values into technological developments in AI, at all stages of development (analysis, design, construction, deployment and evaluation). These frameworks must deal both with the autonomic reasoning of the machine about such issues that we consider to have ethical impact, but most importantly, we need frameworks to guide design choices, to regulate the reaches of AI systems, to ensure proper data stewardship, and to help individuals determine their own involvement. Values are dependent on the socio-cultural context (Turiel 2002), and are often only implicit in deliberation processes, which means that methodologies are needed to elicit the values held by all the stakeholders, and to make these explicit can lead to better understanding and trust on artificial autonomous systems. That is, AI reasoning should be able to take into account societal values, moral and ethical considerations; weigh the respective priorities of values held by different stakeholders in various multicultural contexts; explain its reasoning; and guarantee transparency. Responsible Artificial Intelligence is about human responsibility for the development of intelligent systems along fundamental human principles and values, to ensure human flourishing and wellbeing in a sustainable world. In fact, Responsible AI is more than the ticking of some ethical ‘boxes’ in a report, or the development of some add-on features, or switch-off buttons in AI systems. Rather, responsibility is fundamental",,
Beyond the promise: implementing ethical AI,"Businesses require strong, mandated governance controls to ensure responsible AI use.",Search,2021,19,Ray  Eitel-Porter,AI Ethics,,10.1007/s43681-020-00011-6,https://doi.org/10.1007/s43681-020-00011-6,https://semanticscholar.org/paper/0a7109502e7fe91f4decc3dd3515e1fecbc02da7,https://link.springer.com/content/pdf/10.1007/s43681-020-00011-6.pdf,"Artificial Intelligence (AI) applications can and do have unintended negative consequences for businesses if not implemented with care. Specifically, faulty or biased AI applications risk compliance and governance breaches and damage to the corporate brand. These issues commonly arise from a number of pitfalls associated with AI development, which include rushed development, a lack of technical understanding, and improper quality assurance, among other factors. To mitigate these risks, a growing number of organisations are working on ethical AI principles and frameworks. However, ethical AI principles alone are not sufficient for ensuring responsible AI use in enterprises. Businesses also require strong, mandated governance controls including tools for managing processes and creating associated audit trails to enforce their principles. Businesses that implement strong governance frameworks, overseen by an ethics board and strengthened with appropriate training, will reduce the risks associated with AI. When applied to AI modelling, the governance will also make it easier for businesses to bring their AI deployments to scale.",,
The EU Approach to Ethics Guidelines for Trustworthy Artificial Intelligence,The EU established an independent High-Level Expert Group on Artificial Intelligence in June 2018.,Search,2019,56,Nathalie A. Smuha,Computer Law Review International,,10.9785/cri-2019-200402,https://doi.org/10.9785/cri-2019-200402,https://semanticscholar.org/paper/a00ee7ae4642b986b622e0f48c845e79707b707b,https://lirias.kuleuven.be/bitstream/123456789/640572/2/EU%20Approach%20for%20Trustworthy%20AI%20-%20a%20continuous%20journey.pdf,"As part of its European strategy for Artificial Intelligence (AI), and as a response to the increasing ethical questions raised by this technology, the European Commission established an independent High-Level Expert Group on Artificial Intelligence (AI HLEG) in June 2018. The group was tasked to draft two deliverables: AI Ethics Guidelines and Policy and Investment Recommendations. Nine months later, its first deliverable was published, putting forward a comprehensive framework to achieve “Trustworthy AI” by offering ethical guidance to AI practitioners. This paper dives into the work carried out by the group, focusing in particular on its AI Ethics Guidelines. First, this paper clarifies the context that led to the creation of the AI HLEG and its mandate (I.). Subsequently, it elaborates on the Guidelines’ aim and purpose (II.), and analyses the Guidelines’ drafting process (III.). Particular focus is given to the questions surrounding the respective role played by ethics and law in the AI governance landscape (IV.), as well as some of the challenges that had to be overcome throughout the process (V.). Finally, this paper places the Guidelines in an international context, and sets out the next steps (VI.) ahead on the journey towards an appropriate governance framework for AI (VII.).",,
Establishing the rules for building trustworthy AI,The European Commission’s report ‘Ethics guidelines for trustworthy AI’ facilitates international support for AI solutions that are good for the environment.,Search,2019,67,Luciano  Floridi,Nature Machine Intelligence,,10.1038/S42256-019-0055-Y,https://doi.org/10.1038/S42256-019-0055-Y,https://semanticscholar.org/paper/dc44e2be0f85b6225f05390c570885337a99ef83,https://philpapers.org/archive/FLOETR.pdf,"The European Commission’s report ‘Ethics guidelines for trustworthy AI’ provides a clear benchmark to evaluate the responsible development of AI systems, and facilitates international support for AI solutions that are good for humanity and the environment, says Luciano Floridi.",,
Ethical Artificial Intelligence for Digital Health Organizations,A US-based Digital Health company developed an ethical code for emotional AI services.,Search,2020,9,"Angela  Joerin, Michiel  Rauws, Russell  Fulmer, Valerie  Black",Cureus,,10.7759/cureus.7202,https://doi.org/10.7759/cureus.7202,https://semanticscholar.org/paper/a8f262b28aa4a35196814b447346f99173c4795a,https://www.cureus.com/articles/25462-ethical-artificial-intelligence-for-digital-health-organizations.pdf,"This technical report describes the methods undertaken by a US-based Digital Health company (X2AI or X2 for short) to develop an ethical code for startup environments and other organizations delivering emotional artificial intelligence (AI) services, especially for mental health support. With a growing demand worldwide for scalable, affordable, and accessible health care solutions, the use of AI offers tremendous potential to improve emotional well-being. To realize this potential, it is imperative that AI service providers prioritize clear and consistent ethical guidelines that align with global considerations regarding user safety and privacy. This report offers a template for an ethical code that can be implemented by other emotional AI services and their affiliates. It includes practical guidelines for integrating support from clients, collaborators, and research partners. It also shows how existing ethical systems can inform the development of AI ethics.",,
The Ethics of Artificial Intelligence,One of the ethical issues arising from the possibility of moral AI is the possibility of moral status.,Search,2014,224,"Nick  Bostrom, Eliezer  Yudkowsky",,,10.1017/CBO9781139046855.020,https://doi.org/10.1017/CBO9781139046855.020,https://semanticscholar.org/paper/787996496a300356188ba921f02f926331f80a63,http://intelligence.org/files/EthicsofAI.pdf,"This chapter surveys some of the ethical challenges that may arise as one can create artificial intelligences (AI) of various kinds and degrees. Some challenges of machine ethics are much like many other challenges involved in designing machines. There is nearly universal agreement among modern AI professionals that artificial intelligence falls short of human capabilities in some critical sense, even though AI algorithms have beaten humans in many specific domains such as chess. In creating a superhuman chess player, the human programmers necessarily sacrificed their ability to predict Deep Blue's local, specific game behavior. A different set of ethical issues arises when one can contemplate the possibility that some future AI systems might be candidates for having moral status. One also has moral reasons to treat them in certain ways, and to refrain from treating them in certain other ways. Superintelligence may be achievable by increasing processing speed.",,
Artificial Intelligence (AI) Ethics: Ethics of AI and Ethical AI,AI ethics is still in the infancy stage.,Search,2020,26,"Keng  Siau, Weiyu  Wang",J. Database Manag.,,10.4018/jdm.2020040105,https://doi.org/10.4018/jdm.2020040105,https://semanticscholar.org/paper/39d1f020a585d3f28cb4b4c14497649e6a469ef1,,"Artificial intelligence (AI)-based technology has achieved many great things, such as facial recognition, medical diagnosis, and self-driving cars. AI promises enormous benefits for economic growth, social development, as well as human well-being and safety improvement. However, the low-level of explainability, data biases, data security, data privacy, and ethical problems of AI-based technology pose significant risks for users, developers, humanity, and societies. As AI advances, one critical issue is how to address the ethical and moral challenges associated with AI. Even though the concept of “machine ethics” was proposed around 2006, AI ethics is still in the infancy stage. AI ethics is the field related to the study of ethical issues in AI. To address AI ethics, one needs to consider the ethics of AI and how to build ethical AI. Ethics of AI studies the ethical principles, rules, guidelines, policies, and regulations that are related to AI. Ethical AI is an AI that performs and behaves ethically. One must recognize and understand the potential ethical and moral issues that may be caused by AI to formulate the necessary ethical principles, rules, guidelines, policies, and regulations for AI (i.e., Ethics of AI). With the appropriate ethics of AI, one can then build AI that exhibits ethical behavior (i.e., Ethical AI). This paper will discuss AI ethics by looking at the ethics of AI and ethical AI. What are the perceived ethical and moral issues with AI? What are the general and common ethical principles, rules, guidelines, policies, and regulations that can resolve or at least attenuate these ethical and moral issues with AI? What are some of the necessary features and characteristics of an ethical AI? How to adhere to the ethics of AI to build ethical AI?",,
Ethical Artificial Intelligence - An Open Question,Shaping an AI-friendly environment for people and a people-friendly environment for AI can be a possible answer for finding a shared context of values for both humans and robots.,Search,2017,12,"Alice  Pavaloiu, Utku  Kose",ArXiv,,,,https://semanticscholar.org/paper/b952eaffb220ed192728d2ce7436235827132057,,"Artificial Intelligence (AI) is an effective science which employs strong enough approaches, methods, and techniques to solve unsolvable real world based problems. Because of its unstoppable rise towards the future, there are also some discussions about its ethics and safety. Shaping an AI friendly environment for people and a people friendly environment for AI can be a possible answer for finding a shared context of values for both humans and robots. In this context, objective of this paper is to address the ethical issues of AI and explore the moral dilemmas that arise from ethical algorithms, from pre set or acquired values. In addition, the paper will also focus on the subject of AI safety. As general, the paper will briefly analyze the concerns and potential solutions to solving the ethical issues presented and increase readers awareness on AI safety as another related research interest.",,
A Framework for Ethical AI at the United Nations,"A UN ethical AI framework should include principles, standards, methods, and a policy.",Search,2021,2,Lambert  Hogenhout,ArXiv,,,,https://semanticscholar.org/paper/4212a75ac54080c4861f14616989ae3e30a49c28,,"This paper aims to provide an overview of the ethical concerns in artificial intelligence (AI) and the framework that is needed to mitigate those risks, and to suggest a practical path to ensure the development and use of AI at the United Nations (UN) aligns with our ethical values. The overview discusses how AI is an increasingly powerful tool with potential for good, albeit one with a high risk of negative side-effects that go against fundamental human rights and UN values. It explains the need for ethical principles for AI aligned with principles for data governance, as data and AI are tightly interwoven. It explores different ethical frameworks that exist and tools such as assessment lists. It recommends that the UN develop a framework consisting of ethical principles, architectural standards, assessment methods, tools and methodologies, and a policy to govern the implementation and adherence to this framework, accompanied by an education program for staff.",,Review
The IEEE Global Initiative for Ethical Considerations in Artificial Intelligence and Autonomous Systems [Standards],The IEEE Global Initiative for Ethical Considerations in Artificial Intelligence and Autonomous Systems is a multi-year initiative.,Search,2017,45,"Raja  Chatila, Kay  Firth-Butterflied, John C. Havens, Konstantinos  Karachalios",IEEE Robotics Autom. Mag.,,10.1109/MRA.2017.2670225,https://doi.org/10.1109/MRA.2017.2670225,https://semanticscholar.org/paper/0d3f76dab5f8c270ce3945c4c35ff3a7653853fd,,"Reports on the scope, goals, and initiatives of the IEEE Global Initiative for Ethical Considerations in Artificial Intelligence and Autonomous Systems.",,
