Paper title,Takeaway from abstract,Source,Year,Citations,Authors,Journal,Influential citations,DOI,DOI URL,Semantic Scholar URL,PDF,Abstract,Takeaway suggests yes/no,Study type
Opening the software engineering toolbox for the assessment of trustworthy AI,Software engineering and testing practices can be used for the assessment of trustworthy AI.,Search,2020,2,"Mohit Kumar Ahuja, Mohamed-Bachir  Belaid, Pierre  Bernab'e, Mathieu  Collet, Arnaud  Gotlieb, Chhagan  Lal, Dusica  Marijan, Sagar  Sen, Aizaz  Sharif, Helge  Spieker",NeHuAI@ECAI,,,,https://semanticscholar.org/paper/3b0ff6bd000e9c615d024614343f2c1cf12bf124,,"Trustworthiness is a central requirement for the acceptance and success of human-centered artificial intelligence (AI). To deem an AI system as trustworthy, it is crucial to assess its behaviour and characteristics against a gold standard of Trustworthy AI, consisting of guidelines, requirements, or only expectations. While AI systems are highly complex, their implementations are still based on software. The software engineering community has a long-established toolbox for the assessment of software systems, especially in the context of software testing. In this paper, we argue for the application of software engineering and testing practices for the assessment of trustworthy AI. We make the connection between the seven key requirements as defined by the European Commission's AI high-level expert group and established procedures from software engineering and raise questions for future work.",,
Exploring the Assessment List for Trustworthy AI in the Context of Advanced Driver-Assistance Systems,The European Commission appointed experts to a High-Level Expert Group on AI (AI-HLEG).,Search,2021,,"Markus  Borg, Joshua  Bronson, Linus  Christensson, Fredrik  Olsson, Olof  Lennartsson, Elias  Sonnsjö, Hamid  Ebabi, Martin  Karsberg",2021 IEEE/ACM 2nd International Workshop on Ethics in Software Engineering Research and Practice (SEthics),,10.1109/SEthics52569.2021.00009,https://doi.org/10.1109/SEthics52569.2021.00009,https://semanticscholar.org/paper/3063caad889735cd1279054c09a8cd3befea9848,http://arxiv.org/pdf/2103.09051,"Artificial Intelligence (AI) is increasingly used in critical applications. Thus, the need for dependable AI systems is rapidly growing. In 2018, the European Commission appointed experts to a High-Level Expert Group on AI (AI-HLEG). AI- HLEG defined Trustworthy AI as 1) lawful, 2) ethical, and 3) robust and specified seven corresponding key requirements. To help development organizations, AI-HLEG recently published the Assessment List for Trustworthy AI (ALTAI). We present an illustrative case study from applying ALTAI to an ongoing development project of an Advanced Driver-Assistance System (ADAS) that relies on Machine Learning (ML). Our experience shows that ALTAI is largely applicable to ADAS development, but specific parts related to human agency and transparency can be disregarded. Moreover, bigger questions related to societal and environmental impact cannot be tackled by an ADAS supplier in isolation. We present how we plan to develop the ADAS to ensure ALTAI-compliance. Finally, we provide three recommendations for the next revision of ALTAI, i.e., life-cycle variants, domainspecific adaptations, and removed redundancy.",,
Z-Inspection®: A Process to Assess Trustworthy AI,Z-Inspection® is a process to assess trustworthy AI.,Search,2021,7,"Roberto V. Zicari, John  Brodersen, James  Brusseau, Boris  Düdder, Timo  Eichhorn, Todor  Ivanov, Georgios  Kararigas, Pedro  Kringen, Melissa  McCullough, Florian  Möslein, Naveed  Mushtaq, Gemma  Roig, Norman  Stürtz, Karsten  Tolle, Jesmin Jahan Tithi, Irmhild van Halem, Magnus  Westerlund",IEEE Transactions on Technology and Society,,10.1109/TTS.2021.3066209,https://doi.org/10.1109/TTS.2021.3066209,https://semanticscholar.org/paper/129782466966ed199864a280f69a740d3f6a4c50,https://ieeexplore.ieee.org/ielx7/8566059/9459493/09380498.pdf,"The ethical and societal implications of artificial intelligence systems raise concerns. In this article, we outline a novel process based on applied ethics, namely, Z-Inspection®, to assess if an AI system is trustworthy. We use the definition of trustworthy AI given by the high-level European Commission’s expert group on AI. Z-Inspection® is a general inspection process that can be applied to a variety of domains where AI systems are used, such as business, healthcare, and public sector, among many others. To the best of our knowledge, Z-Inspection® is the first process to assess trustworthy AI in practice.",,
Trustworthiness in Industrial IoT Systems Based on Artificial Intelligence,An automatic online assessment method for the reliability of CPS was proposed in this article.,Search,2021,81,"Zhihan  Lv, Yang  Han, Amit Kumar Singh, Gunasekaran  Manogaran, Haibin  Lv",IEEE Transactions on Industrial Informatics,,10.1109/TII.2020.2994747,https://doi.org/10.1109/TII.2020.2994747,https://semanticscholar.org/paper/79086f67c5d7413a05305478b1b38781588ed19d,,"The intelligent industrial environment developed with the support of the new generation network cyber-physical system (CPS) can realize the high concentration of information resources. In order to carry out the analysis and quantification for the reliability of CPS, an automatic online assessment method for the reliability of CPS is proposed in this article. It builds an evaluation framework based on the knowledge of machine learning, designs an online rank algorithm, and realizes the online analysis and assessment in real time. The preventive measures can be taken timely, and the system can operate normally and continuously. Its reliability has been greatly improved. Based on the credibility of the Internet and the Internet of Things, a typical CPS control model based on the spatiotemporal correlation detection model is analyzed to determine the comprehensive reliability model analysis strategy. Based on this, in this article, we propose a CPS trusted robust intelligent control strategy and a trusted intelligent prediction model. Through the simulation analysis, the influential factors of attack defense resources and the dynamic process of distributed cooperative control are obtained. CPS defenders in the distributed cooperative control mode can be guided and select the appropriate defense resource input according to the CPS attack and defense environment.",,
Traceability for Trustworthy AI: A Review of Models and Tools,A common approach and shared semantics are lacking for traceability tools.,Search,2021,3,"Marçal Mora Cantallops, Salvador  Sánchez-Alonso, Elena García Barriocanal, Miguel-Ángel  Sicilia",Big Data Cogn. Comput.,,10.3390/BDCC5020020,https://doi.org/10.3390/BDCC5020020,https://semanticscholar.org/paper/a8defe1d2e28879ff86e3cb5c6c86b2e78901c6f,https://www.mdpi.com/2504-2289/5/2/20/pdf,"Traceability is considered a key requirement for trustworthy artificial intelligence (AI), related to the need to maintain a complete account of the provenance of data, processes, and artifacts involved in the production of an AI model. Traceability in AI shares part of its scope with general purpose recommendations for provenance as W3C PROV, and it is also supported to different extents by specific tools used by practitioners as part of their efforts in making data analytic processes reproducible or repeatable. Here, we review relevant tools, practices, and data models for traceability in their connection to building AI models and systems. We also propose some minimal requirements to consider a model traceable according to the assessment list of the High-Level Expert Group on AI. Our review shows how, although a good number of reproducibility tools are available, a common approach is currently lacking, together with the need for shared semantics. Besides, we have detected that some tools have either not achieved full maturity, or are already falling into obsolescence or in a state of near abandonment by its developers, which might compromise the reproducibility of the research trusted to them.",,Review
Trustworthy AI: From Principles to Practices,Comprehensive trustworthy AI requires monitoring and governance.,Search,2021,1,"Bo  Li, Peng  Qi, Bo  Liu, Shuai  Di, Jingen  Liu, Jiquan  Pei, Jinfeng  Yi, Bowen  Zhou",ArXiv,,,,https://semanticscholar.org/paper/c3689493757f90267908e776aeada9194fce55c7,,"Fast developing artificial intelligence (AI) technology has enabled various applied systems deployed in the real world, impacting people’s everyday lives. However, many current AI systems were found vulnerable to imperceptible attacks, biased against underrepresented groups, lacking in user privacy protection, etc., which not only degrades user experience but erodes the society’s trust in all AI systems. In this review, we strive to provide AI practitioners a comprehensive guide towards building trustworthy AI systems. We first introduce the theoretical framework of important aspects of AI trustworthiness, including robustness, generalization, explainability, transparency, reproducibility, fairness, privacy preservation, alignment with human values, and accountability. We then survey leading approaches in these aspects in the industry. To unify the current fragmented approaches towards trustworthy AI, we propose a systematic approach that considers the entire lifecycle of AI systems, ranging from data acquisition to model development, to development and deployment, finally to continuous monitoring and governance. In this framework, we offer concrete action items to practitioners and societal stakeholders (e.g., researchers and regulators) to improve AI trustworthiness. Finally, we identify key opportunities and challenges in the future development of trustworthy AI systems, where we identify the need for paradigm shift towards comprehensive trustworthy AI systems.",,Review
Trustworthiness of Artificial Intelligence,A mistake in the development or working phase of an Artificial Intelligence system can be disastrous.,Search,2020,4,"Sonali  Jain, Manan  Luthra, Shagun  Sharma, Mehtab  Fatima",2020 6th International Conference on Advanced Computing and Communication Systems (ICACCS),,10.1109/ICACCS48705.2020.9074237,https://doi.org/10.1109/ICACCS48705.2020.9074237,https://semanticscholar.org/paper/2efae53ba8d84c6f11d3f7151f23b9e22ca806e4,,"This paper discusses the need for a trustworthy AI, along with the ethics which are required to keep that trust intact. AI has a lot of benefits when it comes to societal, individual or cultural development. But any mistake in either the development or in the working phase of the AI system can be disastrous, especially when human lives are involved. The main goal of this paper is to understand what really makes an Artificial Intelligence system trustworthy.",,
Trustworthy AI,The pursuit of responsible AI raises the ante on both the trustworthy computing and formal methods communities.,Search,2021,7,Jeannette M. Wing,Commun. ACM,,10.1145/3448248,https://doi.org/10.1145/3448248,https://semanticscholar.org/paper/33cf9b4d6c76f988380b1adff2c06c30010f93d3,https://dl.acm.org/doi/pdf/10.1145/3448248,The pursuit of responsible AI raises the ante on both the trustworthy computing and formal methods communities.,,
Trustworthy Acceptance: A New Metric for Trustworthy Artificial Intelligence Used in Decision Making in Food-Energy-Water Sectors,A trustworthy acceptance metric can capture and quantify the system’s transparent evaluation by field experts on as many control points as desirable by the users.,Search,2021,1,"Suleyman  Uslu, Davinder  Kaur, Samuel J. Rivera, Arjan  Durresi, Mimoza  Durresi, Meghna  Babbar-Sebens",AINA,,10.1007/978-3-030-75100-5_19,https://doi.org/10.1007/978-3-030-75100-5_19,https://semanticscholar.org/paper/5d6a347ac08ff55ee9ac0234c36d9f41b0d7088c,,"We propose, for the first time, a trustworthy acceptance metric and its measurement methodology to evaluate the trustworthiness of AI-based systems used in decision making in Food Energy Water (FEW) management. The proposed metric is a significant step forward in the standardization process of AI systems. It is essential to standardize the AI systems’ trustworthiness, but until now, the standardization efforts remain at the level of high-level principles. The measurement methodology of the proposed includes human experts in the loop, and it is based on our trust management system. Our metric captures and quantifies the system’s transparent evaluation by field experts on as many control points as desirable by the users. We illustrate the trustworthy acceptance metric and its measurement methodology using AI in decision-making scenarios of Food-Energy-Water sectors. However, the proposed metric and its methodology can be easily adapted to other fields of AI applications. We show that our metric successfully captures the aggregated acceptance of any number of experts, can be used to do multiple measurements on various points of the system, and provides confidence values for the measured acceptance. Suleyman Uslu Indiana University-Purdue University Indianapolis, Indianapolis, IN, USA e-mail: suslu@iu.edu Davinder Kaur Indiana University-Purdue University Indianapolis, Indianapolis, IN, USA e-mail: davikaur@iu.edu Samuel J Rivera Oregon State University, Corvallis, OR, USA e-mail: sammy.rivera@oregonstate.edu Arjan Durresi Indiana University-Purdue University Indianapolis, Indianapolis, IN, USA e-mail: adurresi@iupui.edu Mimoza Durresi European University of Tirana e-mail: mimoza.durresi@uet.edu.al Meghna Babbar-Sebens Oregon State University, Corvallis, OR, USA e-mail: meghna@oregonstate.edu",,
Provenance-based trustworthiness assessment in sensor networks,A cyclic framework well reflects the inter-dependency property in computing trust scores from data provenance and value similarity.,Search,2010,196,"Hyo-Sang  Lim, Yang-Sae  Moon, Elisa  Bertino",DMSN '10,,10.1145/1858158.1858162,https://doi.org/10.1145/1858158.1858162,https://semanticscholar.org/paper/d1ca1ec38eba6d98d08addc6f8fc74f65b25cf4a,http://www.vldb2010.org/proceedings/files/vldb_2010_workshop/DMSN_2010/individual-files/02.lim-10.pdf,"As sensor networks are being increasingly deployed in decision-making infrastructures such as battlefield monitoring systems and SCADA (Supervisory Control and Data Acquisition) systems, making decision makers aware of the trustworthiness of the collected data is a crucial. To address this problem, we propose a systematic method for assessing the trustworthiness of data items. Our approach uses the data provenance as well as their values in computing trust scores, that is, quantitative measures of trustworthiness. To obtain trust scores, we propose a cyclic framework which well reflects the inter-dependency property: the trust score of the data affects the trust score of the network nodes that created and manipulated the data, and vice-versa. The trust scores of data items are computed from their value similarity and provenance similarity. The value similarity comes from the principle that ""the more similar values for the same event, the higher the trust scores"". The provenance similarity is based on the principle that ""the more different data provenances with similar values, the higher the trust scores"". Experimental results show that our approach provides a practical solution for trustworthiness assessment in sensor networks.",,
Trustworthy AI Inference Systems: An Industry Research View,Private AI inference systems require security protection mechanisms and appropriate privacy protection.,Search,2020,2,"Rosario  Cammarota, Matthias  Schunter, Anand  Rajan, Fabian  Boemer, 'Agnes  Kiss, Amos  Treiber, Christian  Weinert, Thomas  Schneider, Emmanuel  Stapf, Ahmad-Reza  Sadeghi, Daniel  Demmler, Huili  Chen, Siam Umar Hussain, Sadegh  Riazi, Farinaz  Koushanfar, Saransh  Gupta, Tajan Simunic Rosing, Kamalika  Chaudhuri, Hamid  Nejatollahi, Nikil  Dutt, Mohsen  Imani, Kim  Laine, Anuj  Dubey, Aydin  Aysu, Fateme Sadat Hosseini, Chengmo  Yang, Eric  Wallace, Pamela  Norton",ArXiv,,,,https://semanticscholar.org/paper/828947e3e9e06c506e6a30e3eb7e176c0b8b953d,,"In this work, we provide an industry research view for approaching the design, deployment, and operation of trustworthy Artificial Intelligence (AI) inference systems. Such systems provide customers with timely, informed, and customized inferences to aid their decision, while at the same time utilizing appropriate security protection mechanisms for AI models. Additionally, such systems should also use Privacy-Enhancing Technologies (PETs) to protect customers' data at any time.

To approach the subject, we start by introducing trends in AI inference systems. We continue by elaborating on the relationship between Intellectual Property (IP) and private data protection in such systems. Regarding the protection mechanisms, we survey the security and privacy building blocks instrumental in designing, building, deploying, and operating private AI inference systems. For example, we highlight opportunities and challenges in AI systems using trusted execution environments combined with more recent advances in cryptographic techniques to protect data in use. Finally, we outline areas of further development that require the global collective attention of industry, academia, and government researchers to sustain the operation of trustworthy AI inference systems.",,
Trustworthy AI: Closing the gap between development and integration of AI systems in ophthalmic practice,"AI for ophthalmic care must be assessed for accuracy, resiliency, reliability, safety, and accountability.",Search,2021,,"Cristina  González-Gonzalo, Eric F. Thee, Caroline C.W. Klaver, Aaron Y. Lee, Reinier O. Schlingemann, Adnan  Tufail, Frank  Verbraak, Clara I. Sánchez",Progress in Retinal and Eye Research,,10.1016/j.preteyeres.2021.101034,https://doi.org/10.1016/j.preteyeres.2021.101034,https://semanticscholar.org/paper/14ac8b3d719781be45a46e7d33fdee702eecce2d,https://pure.eur.nl/ws/files/55297410/Trustworthy_AI_Closing_the_gap_between_development_and_integration_of_AI_systems_in_ophthalmic_practice.pdf,"An increasing number of artificial intelligence (AI) systems are being proposed in ophthalmology, motivated by the variety and amount of clinical and imaging data, as well as their potential benefits at the different stages of patient care. Despite achieving close or even superior performance to that of experts, there is a critical gap between development and integration of AI systems in ophthalmic practice. This work focuses on the importance of trustworthy AI to close that gap. We identify the main aspects or challenges that need to be considered along the AI design pipeline so as to generate systems that meet the requirements to be deemed trustworthy, including those concerning accuracy, resiliency, reliability, safety, and accountability. We elaborate on mechanisms and considerations to address those aspects or challenges, and define the roles and responsibilities of the different stakeholders involved in AI for ophthalmic care, i.e., AI developers, reading centers, healthcare providers, healthcare institutions, ophthalmological societies and working groups or committees, patients, regulatory bodies, and payers. Generating trustworthy AI is not a responsibility of a sole stakeholder. There is an impending necessity for a collaborative approach where the different stakeholders are represented along the AI design pipeline, from the definition of the intended use to post-market surveillance after regulatory approval. This work contributes to establish such multi-stakeholder interaction and the main action points to be taken so that the potential benefits of AI reach real-world ophthalmic settings.",,
In AI We Trust? Factors That Influence Trustworthiness of AI-infused Decision-Making Processes,,Search,2019,7,"Maryam  Ashoori, Justin D. Weisz",ArXiv,,,,https://semanticscholar.org/paper/4155178a77ec7f8775c814c6216002a82d0cab97,,"Many decision-making processes have begun to incorporate an AI element, including prison sentence recommendations, college admissions, hiring, and mortgage approval. In all of these cases, AI models are being trained to help human decision makers reach accurate and fair judgments, but little is known about what factors influence the extent to which people consider an AI-infused decision-making process to be trustworthy. We aim to understand how different factors about a decision-making process, and an AI model that supports that process, influences peoples' perceptions of the trustworthiness of that process. We report on our evaluation of how seven different factors -- decision stakes, decision authority, model trainer, model interpretability, social transparency, and model confidence -- influence ratings of trust in a scenario-based study.",,
Toward Trustworthy AI Development: Mechanisms for Supporting Verifiable Claims,"Ten mechanisms can provide evidence about the safety, security, fairness, and privacy protection of AI systems.",Search,2020,90,"Miles  Brundage, Shahar  Avin, Jasmine  Wang, Haydn  Belfield, Gretchen  Krueger, Gillian  Hadfield, Heidy  Khlaaf, Jingying  Yang, Helen  Toner, Ruth  Fong, Tegan  Maharaj, Pang Wei Koh, Sara  Hooker, Jade  Leung, Andrew  Trask, Emma  Bluemke, Jonathan  Lebensbold, Cullen  O'Keefe, Mark  Koren, Th'eo  Ryffel, JB  Rubinovitz, Tamay  Besiroglu, Federica  Carugati, Jack  Clark, Peter  Eckersley, Sarah de Haas, Maritza  Johnson, Ben  Laurie, Alex  Ingerman, Igor  Krawczuk, Amanda  Askell, Rosario  Cammarota, Andrew  Lohn, David  Krueger, Charlotte  Stix, Peter  Henderson, Logan  Graham, Carina  Prunkl, Bianca  Martin, Elizabeth  Seger, Noa  Zilberman, Se'an 'O h'Eigeartaigh, Frens  Kroeger, Girish  Sastry, Rebecca  Kagan, Adrian  Weller, Brian  Tse, Elizabeth  Barnes, Allan  Dafoe, Paul  Scharre, Ariel  Herbert-Voss, Martijn  Rasser, Shagun  Sodhani, Carrick  Flynn, Thomas Krendl Gilbert, Lisa  Dyer, Saif  Khan, Yoshua  Bengio, Markus  Anderljung",ArXiv,,,,https://semanticscholar.org/paper/62c3142956d54db158d190ce691e3c13e7897412,,"With the recent wave of progress in artificial intelligence (AI) has come a growing awareness of the large-scale impacts of AI systems, and recognition that existing regulations and norms in industry and academia are insufficient to ensure responsible AI development. In order for AI developers to earn trust from system users, customers, civil society, governments, and other stakeholders that they are building AI responsibly, they will need to make verifiable claims to which they can be held accountable. Those outside of a given organization also need effective means of scrutinizing such claims. This report suggests various steps that different stakeholders can take to improve the verifiability of claims made about AI systems and their associated development processes, with a focus on providing evidence about the safety, security, fairness, and privacy protection of AI systems. We analyze ten mechanisms for this purpose--spanning institutions, software, and hardware--and make recommendations aimed at implementing, exploring, or improving those mechanisms.",,
Trustworthy AI in the Age of Pervasive Computing and Big Data,"Trust in AI is intrinsically linked to the ethics of algorithms, the ethics of data, or the ethics of practice.",Search,2020,15,"Abhishek  Kumar, Tristan  Braud, Sasu  Tarkoma, Pan  Hui",2020 IEEE International Conference on Pervasive Computing and Communications Workshops (PerCom Workshops),,10.1109/percomworkshops48775.2020.9156127,https://doi.org/10.1109/percomworkshops48775.2020.9156127,https://semanticscholar.org/paper/f92cedfdf08f7c92ddefebd06fa763d7a8359c1f,http://repository.ust.hk/ir/bitstream/1783.1-101388/1/neutral-ai.pdf,"The era of pervasive computing has resulted in countless devices that continuously monitor users and their environment, generating an abundance of user behavioural data. Such data may support improving the quality of service, but may also lead to adverse usages such as surveillance and advertisement. In parallel, Artificial Intelligence (AI) systems are being applied to sensitive fields such as healthcare, justice, or human resources, raising multiple concerns on the trustworthiness of such systems. Trust in AI systems is thus intrinsically linked to ethics, including the ethics of algorithms, the ethics of data, or the ethics of practice. In this paper, we formalise the requirements of trustworthy AI systems through an ethics perspective. We specifically focus on the aspects that can be integrated into the design and development of AI systems. After discussing the state of research and the remaining challenges, we show how a concrete use-case in smart cities can benefit from these methods.",,
